audio	sentence
/scratch/skscla001/experiments/datasets/bemgen/audio/03-200925-070127_bem_798_elicit_10.wav	icitabo ca natuleya  lets go ca bantu ba mu nkuta shonse
/scratch/skscla001/experiments/datasets/bemgen/audio/03-200918-110406_bem_798_elicit_16.wav	ngatatuletasha fwebene ifyo baletucitila ba katumbi naba katumba inshi twalaba ili pinda lya kasembe kakwete ba tata
/scratch/skscla001/experiments/datasets/bemgen/audio/01-201001-231632_bem_fb0_elicit_11.wav	balamufwaya kuti ngefi babatulila mu citenge bali na cilumendo wakwe wine balenwa ubwalwa
/scratch/skscla001/experiments/datasets/bemgen/audio/01-201005-232741_bem_fb0_elicit_24.wav	nomba uko ayasha ku buko bwakwe pali umuntu umo uwayatumine afililwe no kuyakonsa
/scratch/skscla001/experiments/datasets/bemgen/audio/01-180101-023548_bem_d31_elicit_25.wav	icitumbukamo milimo iyafwa iyo ishitwafwa nangu ukwafwilisha abantu tulefwaya ukupyungila elyo mucinefye tacipeela umucinshi nangu ukusekesha shifwe wesu uwa mu mulu
/scratch/skscla001/experiments/datasets/bemgen/audio/01-180101-031630_bem_d31_elicit_40.wav	pitulukeni nangu fwailisheni ifyo ulu lubembu lwaisa
/scratch/skscla001/experiments/datasets/bemgen/audio/03-201007-015856_bem_798_elicit_66.wav	kati nokuu wafwilapo nobe pa bupulumushi bobe
/scratch/skscla001/experiments/datasets/bemgen/audio/01-180101-042805_bem_d31_elicit_9.wav	cali caku sonsomba apakalamba
/scratch/skscla001/experiments/datasets/bemgen/audio/01-200917-221220_bem_d31_elicit_36.wav	panshita imo ine tulalanga umumfwano wesu pamo nga batetekela
/scratch/skscla001/experiments/datasets/bemgen/audio/01-201011-223928_bem_fb0_elicit_20.wav	tulekasholola aka pa kakopo
/scratch/skscla001/experiments/datasets/bemgen/audio/01-201005-230705_bem_fb0_elicit_39.wav	mwane ati natesha tata nkalacita fyonse ifyo mwanjeba
/scratch/skscla001/experiments/datasets/bemgen/audio/01-201013-134137_bem_fb0_elicit_24.wav	kuti nga bapwa ukuteya bayaiminina ukutali atemwa balasokola nga twile ukutali
/scratch/skscla001/experiments/datasets/bemgen/audio/03-200925-053533_bem_798_elicit_39.wav	ukuti abeni pakati kebumba lyesu bakwate ukutendeka kusuma ukwakutwalilila uku kula mu bwikashi na mwisenge lya nsansa naifwe elyo na shikulu
/scratch/skscla001/experiments/datasets/bemgen/audio/03-200915-234914_bem_798_elicit_49.wav	takapembelela ukukula pakuti kanone
/scratch/skscla001/experiments/datasets/bemgen/audio/01-201005-232741_bem_fb0_elicit_16.wav	kuti mu mushi mwine mwali cibinda nabekalisha baumfwa ku kabanga kwatula inkuta abantu baleililila fye pa kumona uko abantu balefwa
/scratch/skscla001/experiments/datasets/bemgen/audio/01-200929-215409_bem_fb0_elicit_25.wav	batata bansenga baku petauke lelo bamayo bena basezuru ba ku salisbury ku rhodesia
/scratch/skscla001/experiments/datasets/bemgen/audio/01-201002-000224_bem_fb0_elicit_5.wav	bushe iwe ifumo lyobe lilekusekesha
/scratch/skscla001/experiments/datasets/bemgen/audio/01-200918-130145_bem_d31_elicit_35.wav	umwana wandi uwaupa kabili uwakwata bana mutanda abembuka
/scratch/skscla001/experiments/datasets/bemgen/audio/03-201001-105646_bem_798_elicit_3.wav	insaka yaleba pakati kamushi apalesangwa abakalamba nabaice mukufundwa amalango nefyakupanga panga ifyo engabomba mukusowa nefyakuicingilila kubalwani
/scratch/skscla001/experiments/datasets/bemgen/audio/03-201004-110412_bem_798_elicit_38.wav	balalandilafye mu cilimi ca bushimapepo ico na bene balulimi bashumfwa kanofye nga ni bashimapepo nabo
/scratch/skscla001/experiments/datasets/bemgen/audio/01-201005-222019_bem_fb0_elicit_53.wav	umuntunse eya mwandi tata wakulampususha ku cipowe e calenga ukufuma ubushiku bwa lelo waba uli cibusa wandi
/scratch/skscla001/experiments/datasets/bemgen/audio/01-201001-174927_bem_fb0_elicit_27.wav	pa kukanafulunganya fya mukashana joni ateka umutima pa kubutuuka bele balepuma ne lyashi
/scratch/skscla001/experiments/datasets/bemgen/audio/01-180101-045438_bem_d31_elicit_48.wav	ibefye ififine yaba nomutengo umowine
/scratch/skscla001/experiments/datasets/bemgen/audio/03-200925-053533_bem_798_elicit_36.wav	muli fimbi ifilonganino umulungu umo utuntulu ulapeelwa kuli bamembala uwakuletamo amafya bakwete pali uyo mweni ku ntungulushi
/scratch/skscla001/experiments/datasets/bemgen/audio/03-201007-022920_bem_798_elicit_24.wav	ailelondolola fyonse ifyo wishi amwebele
/scratch/skscla001/experiments/datasets/bemgen/audio/03-200921-112400_bem_798_elicit_14.wav	abanakashi balikwata insambu shimo shine nga abaume
/scratch/skscla001/experiments/datasets/bemgen/audio/03-201006-005222_bem_798_elicit_20.wav	umutima umo auti bushe ninshi nsose
/scratch/skscla001/experiments/datasets/bemgen/audio/03-200925-050356_bem_798_elicit_16.wav	twatendeke ukulakumanina pe sukulu kabili no kulabila inganda ne ng'anda
/scratch/skscla001/experiments/datasets/bemgen/audio/01-180101-031848_bem_d31_elicit_26.wav	ukufuma inshita ya fifteen hours ukufika sixteen forty pali cimo ukushinta pali citatu icungulo kwali utubungwe pabula utwamasambililo kwali kusalapofye
/scratch/skscla001/experiments/datasets/bemgen/audio/01-200918-081050_bem_d31_elicit_23.wav	ine naishileba umwina kristu mu nineteen ninety ilyo ba isaiah chalwe bangafwilishe panuma ya kunshimikila imbila nsuma
/scratch/skscla001/experiments/datasets/bemgen/audio/03-200925-053533_bem_798_elicit_30.wav	alingile ukwishiba ifyo twasuminamo no mulandu twasuminina muli ifyo fintu
/scratch/skscla001/experiments/datasets/bemgen/audio/03-200916-040939_bem_798_elicit_24.wav	bupe bwabo teti tubebe ati uku kucita ifi elo kulya filya citemwa mwine
/scratch/skscla001/experiments/datasets/bemgen/audio/01-200922-102640_bem_d31_elicit_45.wav	eico kanshi natupange utubungwe tusuma
/scratch/skscla001/experiments/datasets/bemgen/audio/01-201001-231632_bem_fb0_elicit_29.wav	janet pa kumono bukali bwakwa robin ifilamba fyalapona ubulanda no mwenso fyaisulo mutima wakwe atampa ukulanguluka
/scratch/skscla001/experiments/datasets/bemgen/audio/01-201005-224141_bem_fb0_elicit_36.wav	nomba fyawa fye ku nseko na hehe hehe hehe hehe
/scratch/skscla001/experiments/datasets/bemgen/audio/01-180101-044203_bem_d31_elicit_25.wav	twasangile amalembo ayakalamba kabili ayasuma icakuti nga yaumfwikike bwino bwino kuti yaleta ukucinjishiwa ukukalamba mu bwina kristu bwesu
/scratch/skscla001/experiments/datasets/bemgen/audio/01-201005-222019_bem_fb0_elicit_46.wav	ine nakulashipanda no kubuulako ubuci
/scratch/skscla001/experiments/datasets/bemgen/audio/01-180101-031848_bem_d31_elicit_22.wav	bumpomfu mu mibombele yacilonganino cikalamba nobutumishi bwaciko  ba coen scholtz
/scratch/skscla001/experiments/datasets/bemgen/audio/03-200921-154823_bem_798_elicit_4.wav	ifipe nangu ifyabupe ifingapelwa ukufuma ku lupwa lwa mwanakashi no kuya ku lupwa lwa mwaume ilyo baleupana
/scratch/skscla001/experiments/datasets/bemgen/audio/03-200916-125910_bem_798_elicit_20.wav	niwe cibengele namuncenene uwa meno ngo lupandulo
/scratch/skscla001/experiments/datasets/bemgen/audio/01-200929-221342_bem_fb0_elicit_13.wav	bashifika fye mu biaolo balapingushanya umwakuti balenwena ubwalwa
/scratch/skscla001/experiments/datasets/bemgen/audio/03-200925-010537_bem_798_elicit_43.wav	mu lupwa ulushaishibe shikulu nge mfumu mu mweo wabo
/scratch/skscla001/experiments/datasets/bemgen/audio/01-180101-134124_bem_d31_elicit_7.wav	ulya wena ta monaka bwino kwati mwana wa mfumu
/scratch/skscla001/experiments/datasets/bemgen/audio/01-201006-002700_bem_fb0_elicit_42.wav	kanshi eco no busanso bwa nsoka bwacepedako mulandu we mijomba
/scratch/skscla001/experiments/datasets/bemgen/audio/03-201007-004908_bem_798_elicit_21.wav	kabili nabaishibe ukuti ni mfumuku mwabo kuntu afuma niomba umucinshi bamupeelo ukalamba saana
/scratch/skscla001/experiments/datasets/bemgen/audio/01-201002-000224_bem_fb0_elicit_8.wav	ninshi apwa ilyo janet amwene aya mashiwi mukwai atala aikata na mu mutwe ubulanda bwamwishila ubukalamba
/scratch/skscla001/experiments/datasets/bemgen/audio/03-200925-061220_bem_798_elicit_10.wav	ifya kulanda no kulanda ifyo
/scratch/skscla001/experiments/datasets/bemgen/audio/01-200921-192247_bem_d31_elicit_31.wav	tulingile ukulabelenga pamo no kusambilile cebo cilabushiku
/scratch/skscla001/experiments/datasets/bemgen/audio/01-200922-012211_bem_d31_elicit_20.wav	imo pali aya mayanda ilifye mupepi nokupwa
/scratch/skscla001/experiments/datasets/bemgen/audio/01-200922-093621_bem_d31_elicit_20.wav	lelo paulo aile ku mwalo mu kuitemenwa mu kuimona ukucenjela na bumushilo ukucila bonse
/scratch/skscla001/experiments/datasets/bemgen/audio/03-200924-214522_bem_798_elicit_32.wav	icipingo citupeela na fimbipo ifishinka ifingatulenga ukuba mwisenge nabena kristu bambi
/scratch/skscla001/experiments/datasets/bemgen/audio/03-201004-103454_bem_798_elicit_33.wav	kanshi ico cine calishalilila
/scratch/skscla001/experiments/datasets/bemgen/audio/01-200921-163326_bem_d31_elicit_22.wav	elyo twingabomba pamo nga yesu uwalesambilisha bantu mu maka ico alishibe fintu alelandapo
/scratch/skscla001/experiments/datasets/bemgen/audio/01-200918-101707_bem_d31_elicit_41.wav	pakubala cikankala ukwishibo kuti fintu balepekanya fya misepela
/scratch/skscla001/experiments/datasets/bemgen/audio/01-200922-003122_bem_d31_elicit_4.wav	ukuba bamembala bapimpa mu cilonganino ca christian brethren church nangu icilonganino cimbi ica evangelical church ica ishibikwa
/scratch/skscla001/experiments/datasets/bemgen/audio/01-200921-235328_bem_d31_elicit_5.wav	pakuti abe nabo  ekuti akwate inshita yakwikala nabo
/scratch/skscla001/experiments/datasets/bemgen/audio/03-200924-200908_bem_798_elicit_11.wav	uwatetekela onse alisubwa kukuba imfumu nga iwe
/scratch/skscla001/experiments/datasets/bemgen/audio/01-180101-031848_bem_d31_elicit_39.wav	ku congo kenya na nigeria bapeele utusebo pali cisano
/scratch/skscla001/experiments/datasets/bemgen/audio/01-201002-000224_bem_fb0_elicit_31.wav	joni asantika utwaice atupela na bishiketi twaya na kumwabo
/scratch/skscla001/experiments/datasets/bemgen/audio/01-200929-215409_bem_fb0_elicit_28.wav	joni mukwai njikala ku mine compound
/scratch/skscla001/experiments/datasets/bemgen/audio/03-200925-003120_bem_798_elicit_43.wav	lyena ninshi yalubililafye  libe tefyo twalefwaya
/scratch/skscla001/experiments/datasets/bemgen/audio/01-180101-020137_bem_d31_elicit_0.wav	ukunaka ukucila mu cipimo waba mutande uwisa panono panono pamulandu wa muntu ukushupikwa mu matontonkanyo na ku mubili mu mano na ku mupashi
/scratch/skscla001/experiments/datasets/bemgen/audio/03-200921-162447_bem_798_elicit_21.wav	elyona ukutiinya abaice nangu ifiteekwa
/scratch/skscla001/experiments/datasets/bemgen/audio/03-200921-114142_bem_798_elicit_29.wav	talelipilwa amalipilo yapa milimo yakwe nangu amoneka ukuti alelipila inkongole ku wamwingisha incito nangu umuntu umbi
/scratch/skscla001/experiments/datasets/bemgen/audio/01-201002-002057_bem_fb0_elicit_12.wav	ine nati aleseka fye kanshi cinecine
/scratch/skscla001/experiments/datasets/bemgen/audio/03-200916-033028_bem_798_elicit_46.wav	muli fyonse talaba ukulengula
/scratch/skscla001/experiments/datasets/bemgen/audio/03-201001-100406_bem_798_elicit_15.wav	batila canda uucita icibusa nabanakashi ninshi cipuba
/scratch/skscla001/experiments/datasets/bemgen/audio/03-200921-105818_bem_798_elicit_44.wav	umuntu nga ayambula akashiishi ka kolonavailasi twenty nineteen bushe papita inshiku shinga pakuti alwale
/scratch/skscla001/experiments/datasets/bemgen/audio/01-201005-224141_bem_fb0_elicit_41.wav	fyaikala fye shilili
/scratch/skscla001/experiments/datasets/bemgen/audio/17-200916-192637_bem_346_elicit_41.wav	cinshi ukusakamana  ku nyimba baleshita amataba na cilemba ya soya
/scratch/skscla001/experiments/datasets/bemgen/audio/01-180101-140752_bem_d31_elicit_7.wav	tiyeni imitwale ku sitesheni ba yama benu limbi nabafika
/scratch/skscla001/experiments/datasets/bemgen/audio/03-200925-062606_bem_798_elicit_6.wav	muli ayo makalata abatumwa balembele pamulandu wa fintu fimo pamo na mafya yantu abalimo balekwata
/scratch/skscla001/experiments/datasets/bemgen/audio/01-200922-110537_bem_d31_elicit_29.wav	pali bakalemba nabakwilula
/scratch/skscla001/experiments/datasets/bemgen/audio/03-201006-013752_bem_798_elicit_48.wav	ku ofeshi ninshi baleisula eight hours
/scratch/skscla001/experiments/datasets/bemgen/audio/03-201004-103454_bem_798_elicit_14.wav	babala balongana cinshinshi kunse ya mushi bacilolo beka bena e basosafye mu kapopo amashiwi yepaalo no kusheto muti nshita fye yonse balefwisa na mate
/scratch/skscla001/experiments/datasets/bemgen/audio/01-201011-221153_bem_fb0_elicit_18.wav	nelyo fye uwakulekelesha
/scratch/skscla001/experiments/datasets/bemgen/audio/03-200916-010158_bem_798_elicit_36.wav	kwikoshi kwena telingi
/scratch/skscla001/experiments/datasets/bemgen/audio/01-201006-110929_bem_fb0_elicit_44.wav	mwalishiba ububi bwenda bwangu ukucila ubusuma
/scratch/skscla001/experiments/datasets/bemgen/audio/01-200918-130145_bem_d31_elicit_39.wav	apo nabembuka amapepo tayafute ificitike
/scratch/skscla001/experiments/datasets/bemgen/audio/17-200915-120130_bem_346_elicit_44.wav	naine nali nensansa pakubamona
/scratch/skscla001/experiments/datasets/bemgen/audio/03-201007-013831_bem_798_elicit_14.wav	bakumbatana balaingila na mu nganda
/scratch/skscla001/experiments/datasets/bemgen/audio/03-201002-091908_bem_798_elicit_31.wav	ekutila ifi fyacitika tewe fyabalilapo ukucitikila naifwe fyalitucitikile na banoko kumo
/scratch/skscla001/experiments/datasets/bemgen/audio/01-200922-110537_bem_d31_elicit_36.wav	ubushiku bwa kukanshiwa bwa kwilulwa
/scratch/skscla001/experiments/datasets/bemgen/audio/03-200925-003120_bem_798_elicit_4.wav	kabili no kufuntula imilimo ya mupusushi wesu pano isonde
/scratch/skscla001/experiments/datasets/bemgen/audio/03-200925-010537_bem_798_elicit_33.wav	lelo ubunte bwe pusukilo bwabafye umuku umo pafyo lesa atupususha ukutufumya ku lubembu
/scratch/skscla001/experiments/datasets/bemgen/audio/01-180101-031848_bem_d31_elicit_35.wav	ukwamba pali cimo ukushinta pali citatu kwaleba utusebo ukufuma mufyalo nangula amabunte
/scratch/skscla001/experiments/datasets/bemgen/audio/03-200918-110406_bem_798_elicit_20.wav	ngatatuleitasha ukatutanasha ni nani
/scratch/skscla001/experiments/datasets/bemgen/audio/01-200917-221220_bem_d31_elicit_33.wav	takwaba mafunde ayaimikwa pamuland wa ici cibukisho
/scratch/skscla001/experiments/datasets/bemgen/audio/01-201001-201528_bem_fb0_elicit_46.wav	cilumendo abwela akumbatila na janet abika no kuboko kumbi mu musana wakwa janet
/scratch/skscla001/experiments/datasets/bemgen/audio/03-200921-162447_bem_798_elicit_3.wav	abopana nabaume banabo
/scratch/skscla001/experiments/datasets/bemgen/audio/01-201001-204524_bem_fb0_elicit_12.wav	e kuti joni aleti nga aikata umupila janet apo ekele te pa kulumba
/scratch/skscla001/experiments/datasets/bemgen/audio/01-201006-002700_bem_fb0_elicit_33.wav	umiuntunee weweta ako mwalumbula kanono nabakalelya fye ponse apo bakalafwaila
/scratch/skscla001/experiments/datasets/bemgen/audio/01-200922-000917_bem_d31_elicit_29.wav	ubunte bulabomba nokwafwilisha apakalamba mu nshita ishapusana pusana mufifulo ne ncende isha pusana
/scratch/skscla001/experiments/datasets/bemgen/audio/01-180101-062208_bem_d31_elicit_6.wav	lelo mukulekelesha panuma ya nshiku mutanda six iya lwendo lwa cibe ro na bawishi bafikile pa churachandpur mission school
/scratch/skscla001/experiments/datasets/bemgen/audio/03-200924-214522_bem_798_elicit_21.wav	kuti catwafwa ukupwisha ici ciputulwa ne cilangililo ca lukuni lwa milimo
/scratch/skscla001/experiments/datasets/bemgen/audio/01-200917-234543_bem_d31_elicit_15.wav	icali mu mapange yakwa lesa cakuti yesu abe pakati ka bantu no kuisokolola pakutendeka kwa bubomfi bwakwe bwine
/scratch/skscla001/experiments/datasets/bemgen/audio/03-200925-062606_bem_798_elicit_12.wav	abantu bonse bali abantungwa ukubelenga ici citabo makamaka abali mu nkunta ishileshimpwa muli ino myaka
/scratch/skscla001/experiments/datasets/bemgen/audio/01-200914-200932_bem_d31_elicit_11.wav	indalama ya tiketi iyii two hundred kwacha
/scratch/skscla001/experiments/datasets/bemgen/audio/03-200925-050356_bem_798_elicit_13.wav	mukwai kwali kensha we shitima na umbi uwaishile uyo uwalelongana kale ku christian brethren
/scratch/skscla001/experiments/datasets/bemgen/audio/01-201001-201528_bem_fb0_elicit_14.wav	ala laifi muno lusaka nomba elyo acilile ukununkila
/scratch/skscla001/experiments/datasets/bemgen/audio/03-201006-021353_bem_798_elicit_10.wav	kabili ngolafwayo kuti ukamuupe takwaba cacila pa kumwafwa ngalecula mu nshila ii ukumutalalikako mutima
/scratch/skscla001/experiments/datasets/bemgen/audio/01-201004-205737_bem_fb0_elicit_17.wav	kuti balenukapo fye balakunta fye umutwe abati yaba yaba ubu bwalwa ubukali ee mwandi bamayo baishiba ukusashika umusheto
/scratch/skscla001/experiments/datasets/bemgen/audio/03-201002-063230_bem_798_elicit_8.wav	kolala banda uwalebomba ku sugar refinery
/scratch/skscla001/experiments/datasets/bemgen/audio/03-201002-054811_bem_798_elicit_48.wav	umo ali kusukulu
/scratch/skscla001/experiments/datasets/bemgen/audio/01-200917-234543_bem_d31_elicit_23.wav	tusambilila pamulandu wa uku kusubwa ilintu yesu akulumbwile muli luka
/scratch/skscla001/experiments/datasets/bemgen/audio/03-201006-002050_bem_798_elicit_27.wav	mu nshila mwalilalwa nga waenda ne bumba cintu cayafya ukucenele mu macushi yonse
/scratch/skscla001/experiments/datasets/bemgen/audio/01-201002-003945_bem_fb0_elicit_18.wav	aipusha kondakita ati bushe uko balolela ishitima nikwi kabili lili no kwima nshita nshi
/scratch/skscla001/experiments/datasets/bemgen/audio/03-200925-003120_bem_798_elicit_16.wav	lutampulo nshi twalasenda pamo nge ntungulushi
/scratch/skscla001/experiments/datasets/bemgen/audio/01-201001-225221_bem_fb0_elicit_29.wav	ubwalwa nabo tabwangasha janet abusenda na mu ngala
/scratch/skscla001/experiments/datasets/bemgen/audio/01-180101-120903_bem_d31_elicit_16.wav	nshili munobe nalakukansula ulupii ine
/scratch/skscla001/experiments/datasets/bemgen/audio/01-201012-193916_bem_fb0_elicit_36.wav	kwena kwaba na bambi abasuma abakuti balelililako na bakalamba ubulanda pa kumona ifyo balepitana mu milimo
/scratch/skscla001/experiments/datasets/bemgen/audio/01-200921-163326_bem_d31_elicit_6.wav	balipelwe nsambu shakuba inte shakwa kristu kabili abakwimininako kristu
/scratch/skscla001/experiments/datasets/bemgen/audio/01-200914-213535_bem_d31_elicit_37.wav	takuli elyo uyo ndefwaya ukupa ine mwana wa mfumu
/scratch/skscla001/experiments/datasets/bemgen/audio/03-200920-120041_bem_798_elicit_0.wav	bushe ubulwele bwa kolonavailasi twenty nineteen buulwele nshi
/scratch/skscla001/experiments/datasets/bemgen/audio/01-201002-005539_bem_fb0_elicit_15.wav	apo janet te pa nsansa pa kusanga tafikile ku citesheni ce shitima uko aumfwa ilyashi lya nkubula mutima lyapoma nge cipoma
/scratch/skscla001/experiments/datasets/bemgen/audio/01-200922-110537_bem_d31_elicit_49.wav	ukwishiba umusango twakulalembelamo icibemba
/scratch/skscla001/experiments/datasets/bemgen/audio/01-201001-231632_bem_fb0_elicit_35.wav	janet ati ee cinecine babukwe nga mwacinguma fye pantu nimbifya
/scratch/skscla001/experiments/datasets/bemgen/audio/03-200925-010537_bem_798_elicit_48.wav	mu nineteen seventy five ilyo napwile isukulu mu form two umweo wandi wali uwakuiposaika mufya mu calo
/scratch/skscla001/experiments/datasets/bemgen/audio/01-201006-002700_bem_fb0_elicit_28.wav	bafika baikala nga filya balatwusha
/scratch/skscla001/experiments/datasets/bemgen/audio/01-200917-132419_bem_d31_elicit_45.wav	nga cakuti lesa apela babomfi bakwe umulimo tapelela fye pakubapela maka lelo alabapela mano no kubatungulula pamo no kubalanga apakubombela
/scratch/skscla001/experiments/datasets/bemgen/audio/01-180102-181703_bem_d31_elicit_44.wav	necikalamba ico twaishila kuno ncende cakutila twalyumfwa ukuti icitungu caku kabanga calitebelwa nobulwele bwa malaria
/scratch/skscla001/experiments/datasets/bemgen/audio/01-201011-231356_bem_fb0_elicit_4.wav	kuti batoola fye ifingi tabasakamana na kubabwa kuli sepe wine cikulu imisepe yamoneka
/scratch/skscla001/experiments/datasets/bemgen/audio/01-180101-060018_bem_d31_elicit_6.wav	ukulapila inshila yakwa lesa iye pusukilo pamo no bwelelo ku maka ya mupashi wa mushilo efilengo muntu nelyo lukuta ukushininwa pamulandu wa lubembu elyo kwaba ukulapila
/scratch/skscla001/experiments/datasets/bemgen/audio/01-200930-150533_bem_fb0_elicit_52.wav	janet atile ashilembela abafyashi bakwe ku lusaka papita fye isha kupenda bayasuka no kusumina basumina
/scratch/skscla001/experiments/datasets/bemgen/audio/03-200925-003120_bem_798_elicit_27.wav	lelo tusubilafye ukuti fyonse fili nokubafye bwino
/scratch/skscla001/experiments/datasets/bemgen/audio/01-180101-062208_bem_d31_elicit_39.wav	elyo amenso yabili aya bulungana yalebengeshima mu nika
/scratch/skscla001/experiments/datasets/bemgen/audio/01-201006-002700_bem_fb0_elicit_0.wav	elyo munkalamo ati mwe bana bandi shimoneni imfula yakalika
/scratch/skscla001/experiments/datasets/bemgen/audio/03-201006-005222_bem_798_elicit_1.wav	cilya bafika kuti pa kumuposha baleimika ne filimi fya mafumo pa lukasa lwakwe ifyatwa
/scratch/skscla001/experiments/datasets/bemgen/audio/01-201012-180720_bem_fb0_elicit_11.wav	limbi nga ashuka kuti aya mu kulya lelo nga emine nalo noko aya lumo lwine
/scratch/skscla001/experiments/datasets/bemgen/audio/01-180102-143243_bem_d31_elicit_60.wav	eico umukashi wakwe aishilemona ati papita imyaka ukwabula ukutwala insalamu
/scratch/skscla001/experiments/datasets/bemgen/audio/01-180101-060018_bem_d31_elicit_47.wav	nangula ukutendeka kwa filonganino fya christian brethren mu zambia kuli ne myaka ukucila na pa mwanda umo
/scratch/skscla001/experiments/datasets/bemgen/audio/03-200923-215451_bem_798_elicit_48.wav	cinshi cali no kukonkapo
/scratch/skscla001/experiments/datasets/bemgen/audio/01-201005-234215_bem_fb0_elicit_16.wav	kuti cilya umuntu aikala fye akashita kanono aumfwa bamunkalamo abati
/scratch/skscla001/experiments/datasets/bemgen/audio/03-200925-050356_bem_798_elicit_11.wav	ba new apostolic church ne cilonganino icinono ica ba baptist fyalitendeka umulimo nafyo
/scratch/skscla001/experiments/datasets/bemgen/audio/01-201005-224141_bem_fb0_elicit_16.wav	awe fyasunguka nganshi pa kumona ubushishi bwacepa filya emo baleipaila isabi lyafula filya kabili ilikalamba
/scratch/skscla001/experiments/datasets/bemgen/audio/01-201004-201313_bem_fb0_elicit_46.wav	umuntunse ati aloleshe ilya milile mu mutima ati
/scratch/skscla001/experiments/datasets/bemgen/audio/03-200924-204525_bem_798_elicit_12.wav	isenge lishiwi libomfiwa lyonse lyonse mu bwina kristu
/scratch/skscla001/experiments/datasets/bemgen/audio/10-200914-180622_bem_346_elicit_33.wav	namucimona ici icimuti
/scratch/skscla001/experiments/datasets/bemgen/audio/01-201001-234513_bem_fb0_elicit_26.wav	ubushiku bwakonkapo joni aya ku kumona abasungu bakwe ku ncito awe bayanupeela ubushiku bumbi ubwa kutuusha pakuti abweshe amaka
/scratch/skscla001/experiments/datasets/bemgen/audio/01-200929-223449_bem_fb0_elicit_21.wav	kabili amupilula amolu evans awa panshi ubuuseneme atampa no kupapaata
/scratch/skscla001/experiments/datasets/bemgen/audio/01-200918-075458_bem_d31_elicit_32.wav	nakabili ukwabulo mutwe umubili untu wafwa
/scratch/skscla001/experiments/datasets/bemgen/audio/03-200916-040939_bem_798_elicit_48.wav	ubulamu tabulisha kasuma
/scratch/skscla001/experiments/datasets/bemgen/audio/03-200921-165915_bem_798_elicit_18.wav	ilyashi nalimbi pa mutitikisha wamu ndupwa ne fitupa kuti lyasangwa pe buula lya pa intaneti ilya ciputulwa cibombela ku fya mukati ka calo pa wwwhomeaffairsgovau
/scratch/skscla001/experiments/datasets/bemgen/audio/01-200917-202141_bem_d31_elicit_9.wav	no mupashi wakwa yehoba walompokele pali dabidi ukufuma pali kalya kasuba no kupulamo
/scratch/skscla001/experiments/datasets/bemgen/audio/03-201002-093346_bem_798_elicit_19.wav	lumbula imisango itatu iya fyuupo fya kulubemba
/scratch/skscla001/experiments/datasets/bemgen/audio/10-200914-180622_bem_346_elicit_41.wav	lumbanyeni zambia nokwanga
/scratch/skscla001/experiments/datasets/bemgen/audio/01-201005-212422_bem_fb0_elicit_23.wav	ifwe natukayeteya ikunku ku mulu wa muti tukakwikemo na mafumo
/scratch/skscla001/experiments/datasets/bemgen/audio/01-200929-223449_bem_fb0_elicit_32.wav	joni aciyakumanya ababiye robin alamwipusha ati we mwaume nga ilya nkulle waimwene kwi
/scratch/skscla001/experiments/datasets/bemgen/audio/01-200918-120021_bem_d31_elicit_48.wav	alesubila ukuti ukulanshanya na bawishi tekuti kukokole
/scratch/skscla001/experiments/datasets/bemgen/audio/10-200914-180622_bem_346_elicit_46.wav	twikatane bonse
/scratch/skscla001/experiments/datasets/bemgen/audio/01-201004-201313_bem_fb0_elicit_6.wav	icishele yapalama na ku muti wine umuntu alesaila yasosa aiti
/scratch/skscla001/experiments/datasets/bemgen/audio/03-200916-040939_bem_798_elicit_44.wav	ifilayo fyebo fyaliya no mwela
/scratch/skscla001/experiments/datasets/bemgen/audio/03-201006-011410_bem_798_elicit_0.wav	aendele bushiku bonse asuka afika ku blueville lucelocelo fye akasuba lakalafika na kuli eight hours
/scratch/skscla001/experiments/datasets/bemgen/audio/01-200921-235328_bem_d31_elicit_47.wav	cikankala ukwibukiisha ukuti abantu ikumi limo na babili abo yesu asontele mu versi fourteen bamo bene abo abali mu vesi thirteen
/scratch/skscla001/experiments/datasets/bemgen/audio/01-200930-150533_bem_fb0_elicit_18.wav	bwangubwangu joni amukwempa amolu pali cikaoboi peter ayapona na mu mufolo mu mbali ya musebo
/scratch/skscla001/experiments/datasets/bemgen/audio/03-200924-222234_bem_798_elicit_13.wav	kafundisha wa cipingo mukwafwilisha atile kuli amashiwi yane ngaya
/scratch/skscla001/experiments/datasets/bemgen/audio/03-201006-002050_bem_798_elicit_13.wav	mwe bantu bandi moneni ifyo icaalo candi ciletenta ku balwani aba batushingauka mpanga yonse
