audio	sentence
/scratch/skscla001/experiments/datasets/bemgen/audio/01-200930-154723_bem_fb0_elicit_3.wav	awe mwandi mwe balumendo balelo mwaba no bufi nshatala mona
/scratch/skscla001/experiments/datasets/bemgen/audio/03-201002-051828_bem_798_elicit_23.wav	balume bakwa mayo ciwanangala ebapingwile imilandu yakwa john chalinkonka nokumulipilisha five pounshi
/scratch/skscla001/experiments/datasets/bemgen/audio/01-201011-223928_bem_fb0_elicit_5.wav	naimona menso kubekabeka nga ne ulele pa lwino ndoleni ee
/scratch/skscla001/experiments/datasets/bemgen/audio/01-200922-110537_bem_d31_elicit_33.wav	pakusanga inshila iisuma mukushitisha ama magazine
/scratch/skscla001/experiments/datasets/bemgen/audio/17-200916-193611_bem_346_elicit_42.wav	wikala mupepi ne sukulu elo kabili naucelwa
/scratch/skscla001/experiments/datasets/bemgen/audio/17-200916-152419_bem_346_elicit_23.wav	bweleleni mu kilasi
/scratch/skscla001/experiments/datasets/bemgen/audio/01-200922-084033_bem_d31_elicit_31.wav	bushe apo mutontonkanya apabela amafya yene yene ni pi
/scratch/skscla001/experiments/datasets/bemgen/audio/01-201006-105203_bem_fb0_elicit_50.wav	mulamona na lino line imbwa no mumbulu tafyapatana kuti nga fyakumana filenunshanya fye
/scratch/skscla001/experiments/datasets/bemgen/audio/03-201002-091908_bem_798_elicit_0.wav	mulandushi ukalamba ba kambole balembele ici citabo kusungila abana kukula mutambi shimo shimo isha babemba nemitundu iimbi
/scratch/skscla001/experiments/datasets/bemgen/audio/01-201011-223928_bem_fb0_elicit_9.wav	nomba uo alumbula nga cakuti e ukwete nanda ninshi nabo pali iyo mpuka bashuka e bali no kucita fyonse ifyacilacita abanabo
/scratch/skscla001/experiments/datasets/bemgen/audio/03-201006-005222_bem_798_elicit_28.wav	shamitombo amaano yamupwa ebele ndefuma shaani
/scratch/skscla001/experiments/datasets/bemgen/audio/01-200918-113920_bem_d31_elicit_41.wav	pamulandu wakuti ebo uyu mulimo wa magazini ushingeme ni bena bakalapingula mukulekelesha palwa fintu ifilingile ukuba muli magazini
/scratch/skscla001/experiments/datasets/bemgen/audio/03-201007-002328_bem_798_elicit_1.wav	muka wongo baima na koyikoyi bakungushanya balaya ku cuulu
/scratch/skscla001/experiments/datasets/bemgen/audio/01-180101-020958_bem_d31_elicit_21.wav	ingala ishitali ukucila isha kalamo
/scratch/skscla001/experiments/datasets/bemgen/audio/03-200921-162447_bem_798_elicit_19.wav	ukutalusha umunobe ku fibusa nangu ku lupwa
/scratch/skscla001/experiments/datasets/bemgen/audio/01-200922-110537_bem_d31_elicit_11.wav	magazine ya bena kristu ukuli konse pano isonde
/scratch/skscla001/experiments/datasets/bemgen/audio/03-200918-110406_bem_798_elicit_36.wav	nga cakuti ba lumumba ba moise tshombe balelumbwa nici kuli abalebalumbula abalelemba pali bena
/scratch/skscla001/experiments/datasets/bemgen/audio/01-200929-221342_bem_fb0_elicit_37.wav	ilyo ingoma ya jaivi yatampile ukulila janet aipusha joni nga kuti ajaiva
/scratch/skscla001/experiments/datasets/bemgen/audio/01-201002-005539_bem_fb0_elicit_8.wav	twawisha akasuba ku mulandu wa kuwaya motoka
/scratch/skscla001/experiments/datasets/bemgen/audio/01-201006-093742_bem_fb0_elicit_44.wav	nkalamo nao aeba ifita fyakwe ati aleni bane nya filya namwebele mailo icungulo natutendeke nombaline ulya roulimo
/scratch/skscla001/experiments/datasets/bemgen/audio/01-200917-132419_bem_d31_elicit_44.wav	takwaba uwaishibisha imilimo yakwa lesa pantu lesa kuti aimya no kubomfya bantu abatutu
/scratch/skscla001/experiments/datasets/bemgen/audio/01-180101-031848_bem_d31_elicit_44.wav	ngeshakwapana capamo nge shilefwa sana icishinka neficitika mubwikashi
/scratch/skscla001/experiments/datasets/bemgen/audio/01-200917-231428_bem_d31_elicit_9.wav	pakutendeka fye marko alefyaya ukuti bakabelenga bamone cishinka cakuti ifyo balebenga lyashi lisuma ku balelibelenga no kulitetekela
/scratch/skscla001/experiments/datasets/bemgen/audio/01-180101-213930_bem_d31_elicit_35.wav	pali ilya inshita lesa aebele umubomfi wakwe ukulanda ku cilibwe
/scratch/skscla001/experiments/datasets/bemgen/audio/03-201002-051828_bem_798_elicit_46.wav	icampuswishe cipepala uyu ndona ampele
/scratch/skscla001/experiments/datasets/bemgen/audio/01-200918-113920_bem_d31_elicit_17.wav	nifinshi ifyo tomas na philippus basambilile pali yesu muli aya mavesi
/scratch/skscla001/experiments/datasets/bemgen/audio/01-180102-181703_bem_d31_elicit_51.wav	ukuti ncende ya vubwi tekuti balelwishafye ubu bulwele bwa malaria
/scratch/skscla001/experiments/datasets/bemgen/audio/01-200922-010446_bem_d31_elicit_44.wav	ba kelvin samwata bacili nobulanda sana ilyo lyonse batulondolwela ici cintu cabacitinkile icabulanda
/scratch/skscla001/experiments/datasets/bemgen/audio/01-201012-190124_bem_fb0_elicit_39.wav	eico babikapo no tumashiwi twakusoka abateya amaliba utwakuti muteya ciliba cenjela nga cakufwanta wilila
/scratch/skscla001/experiments/datasets/bemgen/audio/08-200915-143450_bem_346_elicit_7.wav	awe bushe pensulo yandi ilikwisa
/scratch/skscla001/experiments/datasets/bemgen/audio/01-201006-002700_bem_fb0_elicit_35.wav	twakulakupokololakofye pe pantu nomba ifwe twakulaipaya insoka shonse mu mpanga umo ulunga
/scratch/skscla001/experiments/datasets/bemgen/audio/01-200914-185607_bem_d31_elicit_16.wav	nipesa mwamona impombo pano nine chitemwiko
/scratch/skscla001/experiments/datasets/bemgen/audio/01-200918-101707_bem_d31_elicit_44.wav	iyi milimo ilingile ukusalapule mibili ya misepela
/scratch/skscla001/experiments/datasets/bemgen/audio/01-201002-011519_bem_fb0_elicit_44.wav	daka ati we mwaume nacifwaya ukwisa ku mobe ku kwisashininkisha ili lyashi njumfwile ukuti janet alifyuka
/scratch/skscla001/experiments/datasets/bemgen/audio/01-201012-184652_bem_fb0_elicit_2.wav	umbi wa kuteya utuni tonse utusala panshi utuli nga tumutengu ifipalabuswa bakonkonta bacibangwampopo
/scratch/skscla001/experiments/datasets/bemgen/audio/01-200914-202459_bem_d31_elicit_49.wav	nalikweba chitalu ukuti nga wakwata ubwafya ubuli bonse ufwile wanjeba
/scratch/skscla001/experiments/datasets/bemgen/audio/01-201001-234513_bem_fb0_elicit_45.wav	kabili alishininkishe ukuti ulya kalata tafumine kuli banyina mwaice yafumine kuli kapenta ku lusaka
/scratch/skscla001/experiments/datasets/bemgen/audio/03-201002-063230_bem_798_elicit_11.wav	bushe vera ali naani ishina lya bawishi
/scratch/skscla001/experiments/datasets/bemgen/audio/01-201004-205737_bem_fb0_elicit_18.wav	eya mwandi lelo tulekumana ne filyo
/scratch/skscla001/experiments/datasets/bemgen/audio/01-180101-044203_bem_d31_elicit_1.wav	bakafundisha ba cipingo elyo na baminshoni ukukwata umusonkano wa misepela
/scratch/skscla001/experiments/datasets/bemgen/audio/01-201001-204524_bem_fb0_elicit_37.wav	ala nshilati nkulabe na nomba ncili ndekwibukisha
/scratch/skscla001/experiments/datasets/bemgen/audio/01-201013-141625_bem_fb0_elicit_10.wav	asebela apo impuku shifumina aya na ku kupama iciliba acileta na pa bwendo pene apo asebele
/scratch/skscla001/experiments/datasets/bemgen/audio/01-201001-201528_bem_fb0_elicit_49.wav	joni afilwa ukushipikisha ayapo
/scratch/skscla001/experiments/datasets/bemgen/audio/01-201006-105203_bem_fb0_elicit_32.wav	imbwa mwe bantunse ala ine abanandi balefwaya ukumyanga umubishi ku mashiwi yalya naishilemweba mailo balefwaya ukunjipaya
/scratch/skscla001/experiments/datasets/bemgen/audio/01-201004-205737_bem_fb0_elicit_42.wav	umuntunse alinga fye cilya utulo twafunda kuli bamfubu abuula no mulilo ashingulusha no mutanda onse umutanda wati natititititi
/scratch/skscla001/experiments/datasets/bemgen/audio/03-200924-204525_bem_798_elicit_42.wav	mwisenge line kuti twasambilila twakoseleshiwa twasansamushiwa no kucincishiwa
/scratch/skscla001/experiments/datasets/bemgen/audio/03-201007-011712_bem_798_elicit_12.wav	asuka apamfiwa ukuti atalalikeko maria umutima pa kumulondolwela ukuti nao wine ni mfumu
/scratch/skscla001/experiments/datasets/bemgen/audio/01-200922-100107_bem_d31_elicit_44.wav	lesa amipaale konse uko muli
/scratch/skscla001/experiments/datasets/bemgen/audio/01-201012-192322_bem_fb0_elicit_40.wav	umwana nga atalala asendama no kusendama kuti aleka ukwimba kumfwa nga apitilisha ali no kumutwala kuli banyina ku kumonsha
/scratch/skscla001/experiments/datasets/bemgen/audio/03-200916-133712_bem_798_elicit_19.wav	cumbu munshololwa
/scratch/skscla001/experiments/datasets/bemgen/audio/01-201002-005539_bem_fb0_elicit_45.wav	clara apanga ati ku harare nga ukaya shani
/scratch/skscla001/experiments/datasets/bemgen/audio/01-200930-133148_bem_fb0_elicit_4.wav	aimona uwasambilila ico afika mu standard six nangu aponene mu mashindano te mulandu
/scratch/skscla001/experiments/datasets/bemgen/audio/01-200922-012211_bem_d31_elicit_8.wav	kwaliko umo uwaishilelanda pali uyu mulimo mu lukuta lwesu eico ba membala nabambi baibimbile muli uyu mulimo
/scratch/skscla001/experiments/datasets/bemgen/audio/03-201002-054811_bem_798_elicit_40.wav	amalipilo yalifye ayaciwele wele
/scratch/skscla001/experiments/datasets/bemgen/audio/01-180102-181703_bem_d31_elicit_47.wav	kunuma uku impendwa yalecila napali one thousand eight hundred mu bantu abalifye impendwa one thousand abaleisa kuno nokuti nabalwala ubulwele bwa malaria
/scratch/skscla001/experiments/datasets/bemgen/audio/03-200925-010537_bem_798_elicit_29.wav	bebeni mu lulimi ulo bengomfwa
/scratch/skscla001/experiments/datasets/bemgen/audio/01-180101-141937_bem_d31_elicit_7.wav	katumbi sendakofye iyi hundred kwacha napapata
/scratch/skscla001/experiments/datasets/bemgen/audio/03-200916-125910_bem_798_elicit_3.wav	amashiwi ayalatantama apa pesamba yamo tabayalanda kuncende shimo elyo yambi nayo yalalandwa
/scratch/skscla001/experiments/datasets/bemgen/audio/03-201006-015824_bem_798_elicit_32.wav	shamitombo akatola akatwala na kumwakwe
/scratch/skscla001/experiments/datasets/bemgen/audio/03-201006-025003_bem_798_elicit_32.wav	amaano yali ayamupelenganya nganshi
/scratch/skscla001/experiments/datasets/bemgen/audio/01-201005-224141_bem_fb0_elicit_0.wav	amatukuto ya fyula
/scratch/skscla001/experiments/datasets/bemgen/audio/01-200917-221220_bem_d31_elicit_23.wav	abaletetekela balekoseleshiwa ukulasangwa kukulongana kwa babwananyina tekuipatula ku babwananyina
/scratch/skscla001/experiments/datasets/bemgen/audio/01-180101-023548_bem_d31_elicit_34.wav	muli marko fourteen thirty four tubelenga ubwafya bumo ubo yesu ashingwene nabo umusalaba
/scratch/skscla001/experiments/datasets/bemgen/audio/03-200924-200908_bem_798_elicit_2.wav	mupashi wa mushilo alapilibula ifintu
/scratch/skscla001/experiments/datasets/bemgen/audio/01-200922-084033_bem_d31_elicit_36.wav	cikankala intungulushi ukufwaya inshila isuma iyakumfwaninamo nabana banono ukupitila mufyo nandile kale
/scratch/skscla001/experiments/datasets/bemgen/audio/03-200925-003120_bem_798_elicit_30.wav	muleisunga bwino mulesunga no mukuni onse mupashi wamushilo amupeela ukwangalila
/scratch/skscla001/experiments/datasets/bemgen/audio/03-201006-025003_bem_798_elicit_5.wav	epa kwisafulumuka na malaya twaibile twashamo mwine
/scratch/skscla001/experiments/datasets/bemgen/audio/01-200918-113920_bem_d31_elicit_2.wav	mwilaba ukutila nakuli baifwe bene cila lubembu mulatumbuka ifintu ifibi
/scratch/skscla001/experiments/datasets/bemgen/audio/01-200918-090125_bem_d31_elicit_12.wav	te bantu abengi balemoneka ukukwata ubwafya pali ici
/scratch/skscla001/experiments/datasets/bemgen/audio/03-201003-235942_bem_798_elicit_15.wav	basuka bafika ku cinika icaciyayaya
/scratch/skscla001/experiments/datasets/bemgen/audio/03-200916-015847_bem_798_elicit_0.wav	wenu afyale wilowa
/scratch/skscla001/experiments/datasets/bemgen/audio/03-201006-002050_bem_798_elicit_18.wav	ee taata kabili ninshi naco wawamya
/scratch/skscla001/experiments/datasets/bemgen/audio/01-200922-010446_bem_d31_elicit_5.wav	bushe tubakanye ukusangwako
/scratch/skscla001/experiments/datasets/bemgen/audio/03-201007-002328_bem_798_elicit_3.wav	shamitombo alayo mubiye ati mune naya ku mpanga
/scratch/skscla001/experiments/datasets/bemgen/audio/01-200922-110537_bem_d31_elicit_34.wav	intungulushi ishiletungilila umulimo mufilonganino fyabo
/scratch/skscla001/experiments/datasets/bemgen/audio/01-201012-190124_bem_fb0_elicit_11.wav	inkumwa no bulunga bakuntila mu maliba elyo tunakapelele tuleima nga twaimina mu mulu utuni epakumona twalawa na pa maliba
/scratch/skscla001/experiments/datasets/bemgen/audio/01-200930-081904_bem_fb0_elicit_15.wav	janet oh nalimo ulefwaya ukushita humber bati
/scratch/skscla001/experiments/datasets/bemgen/audio/03-200924-194133_bem_798_elicit_28.wav	kabili cisuma ukwishiba amalembo walayabomfya na mepusho yakwipusha pamo ne filangililo
/scratch/skscla001/experiments/datasets/bemgen/audio/01-200914-200932_bem_d31_elicit_43.wav	awe nimwe ndepepela
/scratch/skscla001/experiments/datasets/bemgen/audio/01-180101-060018_bem_d31_elicit_30.wav	fimbi ifilonganino filabika nefipampa notice board apo bonse bafwile ukumona programme ya church ifyo ubutantiko buli
/scratch/skscla001/experiments/datasets/bemgen/audio/01-201011-221153_bem_fb0_elicit_12.wav	abana na banyinabo kuti batuntikanya iminwe elyo uuli ne nanda ali no kucita shikitishikiti
/scratch/skscla001/experiments/datasets/bemgen/audio/01-200921-235328_bem_d31_elicit_48.wav	umulandu basalilwe wali pabili
/scratch/skscla001/experiments/datasets/bemgen/audio/01-200922-104230_bem_d31_elicit_42.wav	ukutasha kwesu kuti kwaba ukwafye nga nalabako abatwafwilisha ku ndalama
/scratch/skscla001/experiments/datasets/bemgen/audio/03-200916-141341_bem_798_elicit_3.wav	kabusha takolelwe bowa
/scratch/skscla001/experiments/datasets/bemgen/audio/01-201006-110929_bem_fb0_elicit_17.wav	balya bapumbu kabili bapuupu benebene efyo alemweba ifyo fine
/scratch/skscla001/experiments/datasets/bemgen/audio/01-200922-091556_bem_d31_elicit_44.wav	kabili bali no kwendela pamo pa kuya ku lubatisho ku mwalo lelo nathan afunike ninshi kwashele nshiku shibili
/scratch/skscla001/experiments/datasets/bemgen/audio/03-200916-120506_bem_798_elicit_15.wav	emukutila enshita ifyakulya fifula nganshi pantu ninshi abantu nabasombola baleti ngabalya baikuta fimo fileshalako na mufipe
/scratch/skscla001/experiments/datasets/bemgen/audio/01-180101-031630_bem_d31_elicit_5.wav	ici calola mukuti lesa mukulu uwa maka yonse ena eka fye etuntuko lya bwelelo
/scratch/skscla001/experiments/datasets/bemgen/audio/01-201002-000224_bem_fb0_elicit_18.wav	iwe uwakutumine uyu kalata ni cibusa obe kapenta mubiyo ku lusaka kaana
/scratch/skscla001/experiments/datasets/bemgen/audio/01-180101-023953_bem_d31_elicit_1.wav	pantu twamona kuli isaac pa kwisula no kwimba ifishima ifipya alipakeswe sana
/scratch/skscla001/experiments/datasets/bemgen/audio/01-201001-223110_bem_fb0_elicit_26.wav	kuti cilya aleposhita kalata pa post office bakumana na ulya cilumendo baumine kuli joni ku biaolo pa mulandu wa kulanda ifya butumpe na janet
/scratch/skscla001/experiments/datasets/bemgen/audio/03-201004-103454_bem_798_elicit_11.wav	nga kuli ukuya ku mpili sha mipashi yabo pefye cibe cafine cibi
/scratch/skscla001/experiments/datasets/bemgen/audio/01-200922-012211_bem_d31_elicit_35.wav	imibombele yabu cishinka ku babomfi
/scratch/skscla001/experiments/datasets/bemgen/audio/01-201006-112930_bem_fb0_elicit_51.wav	abati ni uyu mukwai bena baletontonkanya ukuti nalimo nabifya balamukalipila pa kumusonta baletalukako no kutaluka
/scratch/skscla001/experiments/datasets/bemgen/audio/01-180101-062208_bem_d31_elicit_7.wav	lyali lisukulu apo abasambi balekukila elyo abalumendo abengi baleikala mu miputule iitwa ama dormitory
/scratch/skscla001/experiments/datasets/bemgen/audio/03-200925-053533_bem_798_elicit_28.wav	ifwe fwe ntungulushi tufwile twalanshanya ne ntungulushi shauko afumine no kufwailikisha
/scratch/skscla001/experiments/datasets/bemgen/audio/01-201012-182347_bem_fb0_elicit_10.wav	kabili basha shibilishibili atemwa lumolumo e mifwi
/scratch/skscla001/experiments/datasets/bemgen/audio/13-201009-113828_bem_40e_elicit_17.wav	cilya nabasanga pa nsaka balanshimikila abati mune umuntu umo ali natwingilila umutali na cimo ifi icayaka sanasana
/scratch/skscla001/experiments/datasets/bemgen/audio/03-200915-234914_bem_798_elicit_19.wav	ndeibukisha kuli bakabelenga ukuti ilyo nsoma ifyo abantu bamo batuka abana besu ba katumbi naba katumba filandetela ubulanda
/scratch/skscla001/experiments/datasets/bemgen/audio/01-201001-201528_bem_fb0_elicit_47.wav	joni apo eminine umutima walafwaya ukufimina pa mutwe
/scratch/skscla001/experiments/datasets/bemgen/audio/03-200925-050356_bem_798_elicit_49.wav	no lupwa lonse lulatotela
/scratch/skscla001/experiments/datasets/bemgen/audio/01-180101-221817_bem_d31_elicit_33.wav	nalisambilishako na bena kristu bamo bamo ifyakubomba nacita amakwebo  mu cilonganino ca mu chinsali elyo no tubungwe utwalekana lekana
/scratch/skscla001/experiments/datasets/bemgen/audio/01-180101-023953_bem_d31_elicit_18.wav	abantu bambi bapalana ishimeli munyina isaaci ifyo ali wa bulwi pe
/scratch/skscla001/experiments/datasets/bemgen/audio/01-201006-110929_bem_fb0_elicit_34.wav	amakanga ala cinecine efyo asosele kuli iwe
/scratch/skscla001/experiments/datasets/bemgen/audio/01-200918-072441_bem_d31_elicit_22.wav	icilonganino atemwa ulukuta lwakwa kristu libumba lya bantu abafyalwa cipya cipya nokufyalwa kwa ku mulu na mupanshi wa mushilo
/scratch/skscla001/experiments/datasets/bemgen/audio/01-201002-005539_bem_fb0_elicit_62.wav	pa seven koloko baima balaya no kuya
/scratch/skscla001/experiments/datasets/bemgen/audio/01-200929-221342_bem_fb0_elicit_31.wav	kuti balafika pa tebulo joni alalangilila janet ku babiye ati bane uyu tuli nankwe ni miss janet phiri cibusa wandi
/scratch/skscla001/experiments/datasets/bemgen/audio/01-201012-192322_bem_fb0_elicit_20.wav	muli ifi fyonse abafyashi babo balatemwa nganshi pantu balamona utwingi uto bashingamona nga bali beka
/scratch/skscla001/experiments/datasets/bemgen/audio/01-180101-223427_bem_d31_elicit_48.wav	aendele imilundu umwanda umo ukupitilila na pa mupaka wa mutundu wa hmar
/scratch/skscla001/experiments/datasets/bemgen/audio/03-201001-100406_bem_798_elicit_14.wav	napakuupa peene kusala ngafilya tusala imbuto pakubyala pantu kwaba limbi mulupwa balilwala ubushiluifibashi atemwa ninkakashi
/scratch/skscla001/experiments/datasets/bemgen/audio/01-180101-023548_bem_d31_elicit_29.wav	nouwen mukutwalilila atile 'ilipusho ilifwile ukutungulula bonse '
/scratch/skscla001/experiments/datasets/bemgen/audio/03-201006-002050_bem_798_elicit_26.wav	shamitombo e pakukana ico taaleefwaya kwishibikwa konse uko alepita ukuti ni mfumu
/scratch/skscla001/experiments/datasets/bemgen/audio/03-200918-110406_bem_798_elicit_40.wav	kabili tulelanda atiuwakwensho bushiku bamutasha ulo bwaca
/scratch/skscla001/experiments/datasets/bemgen/audio/01-201011-225826_bem_fb0_elicit_0.wav	bane natulecita akambe
/scratch/skscla001/experiments/datasets/bemgen/audio/03-200925-053533_bem_798_elicit_8.wav	natotela saana kabili lesa amupale
/scratch/skscla001/experiments/datasets/bemgen/audio/01-180101-141937_bem_d31_elicit_0.wav	letafye impiya shandi fyonse fipwilemo
/scratch/skscla001/experiments/datasets/bemgen/audio/03-200925-062606_bem_798_elicit_27.wav	nakuba ulo lupapulo ulwabapo talwabamo icintu nangu cimo icingatulesha ukufikilisha icimonwa icili conse ico lesa engapeela pa lukuta nelyo mu citungu nangu mu calo conse
/scratch/skscla001/experiments/datasets/bemgen/audio/03-200916-120506_bem_798_elicit_13.wav	kukulekelesha kwa mainsa kwaliba umweshi untu batila shinde
/scratch/skscla001/experiments/datasets/bemgen/audio/01-180101-140752_bem_d31_elicit_47.wav	ndekusebanya umushi onse icakuti na bonse abakutemwa ba cinje amano
/scratch/skscla001/experiments/datasets/bemgen/audio/03-201006-025003_bem_798_elicit_15.wav	nomba koyikoyi ampeele cipope icakukanalanda uyu mulandu ku bantu no kumusokolola apo aikala pa mipili
/scratch/skscla001/experiments/datasets/bemgen/audio/03-200916-040939_bem_798_elicit_42.wav	abantu abengi napa bana besu bamo bamo balilaile abenamwabo ifintu ifingi panshita balefwaya ukuti babasale
/scratch/skscla001/experiments/datasets/bemgen/audio/03-200923-230549_bem_798_elicit_37.wav	leka cibe ukutila ilintu wasangwa mukupusana na bantu bambi te iwe ufitendeke
/scratch/skscla001/experiments/datasets/bemgen/audio/01-200929-215409_bem_fb0_elicit_32.wav	joni oh pa mr thorncroft nalipeshiuba sana mpitapo fye pee kasha epo mwikala
/scratch/skscla001/experiments/datasets/bemgen/audio/17-200916-152419_bem_346_elicit_16.wav	musuma umulumendo
/scratch/skscla001/experiments/datasets/bemgen/audio/01-180101-062208_bem_d31_elicit_42.wav	lyashifye lyakusekesha
/scratch/skscla001/experiments/datasets/bemgen/audio/01-201012-190124_bem_fb0_elicit_32.wav	pantu ukulengula bacita imiku ibili ulucelo ne cungulo
/scratch/skscla001/experiments/datasets/bemgen/audio/01-200922-110537_bem_d31_elicit_10.wav	aka ekabungwe akabomba umulimo wakukansha abo bonse abalefwaya ukutendeka
/scratch/skscla001/experiments/datasets/bemgen/audio/01-180101-042805_bem_d31_elicit_7.wav	bushe kwali ishafumu ishikalamba
/scratch/skscla001/experiments/datasets/bemgen/audio/03-201007-004908_bem_798_elicit_40.wav	maria pa kumfwa amashiwi ya musango uyu camupeseshe na maano
/scratch/skscla001/experiments/datasets/bemgen/audio/03-201006-013752_bem_798_elicit_20.wav	afwaile atile kwena nalibomfwako abo bantu
/scratch/skscla001/experiments/datasets/bemgen/audio/01-180101-140752_bem_d31_elicit_17.wav	mukashi wandi nalikobekela
/scratch/skscla001/experiments/datasets/bemgen/audio/01-180101-023953_bem_d31_elicit_9.wav	twilabo kuti abena gerari abakulwa na ifwe tuli nabo pe
/scratch/skscla001/experiments/datasets/bemgen/audio/01-201012-184652_bem_fb0_elicit_17.wav	bapanga icungulo atemwa lilya balelya ubwali ubwa fisashi ukuti bakayeteya ifiliba fya tuni
/scratch/skscla001/experiments/datasets/bemgen/audio/03-201004-110412_bem_798_elicit_43.wav	umusungu wena ifyakutontonkanya fyafulilako
/scratch/skscla001/experiments/datasets/bemgen/audio/03-200921-112400_bem_798_elicit_4.wav	ba kapokola mu calo ca australia bantu abasuma kabili abacetekelwa
/scratch/skscla001/experiments/datasets/bemgen/audio/01-200922-090011_bem_d31_elicit_41.wav	twalipalilwe apakalamba ku ba bomfi bakwa lesa
/scratch/skscla001/experiments/datasets/bemgen/audio/03-201004-122608_bem_798_elicit_25.wav	tapali nangu umo nomba uwakuba no mwenso nangu amone icili shani
/scratch/skscla001/experiments/datasets/bemgen/audio/03-201002-051828_bem_798_elicit_9.wav	ilyo twaleeya twaikatwa nabambulumatali ababufi awe balangaula abakalamba amapi baipika nafwaka ati tulye nomba natile kusaidi awe bansuminisha
/scratch/skscla001/experiments/datasets/bemgen/audio/01-201001-172058_bem_fb0_elicit_32.wav	kadona oh kanshi cisuma bwelelamo
/scratch/skscla001/experiments/datasets/bemgen/audio/03-201002-085315_bem_798_elicit_23.wav	bushe ali nemyaka inga
/scratch/skscla001/experiments/datasets/bemgen/audio/01-201001-204524_bem_fb0_elicit_1.wav	ubushiku ba ndola baishile ku cibansa ca mupila ica mu mufulira kwaishile no wa ku ibele
/scratch/skscla001/experiments/datasets/bemgen/audio/01-200922-012211_bem_d31_elicit_41.wav	ba willies mukulumoya bamalonda wabushiku bacili baliluba
/scratch/skscla001/experiments/datasets/bemgen/audio/01-201001-204524_bem_fb0_elicit_42.wav	ala ni nakulu bantu alileka no kusamba wakwenda fye ne fitatilo mu numa
/scratch/skscla001/experiments/datasets/bemgen/audio/03-200924-204525_bem_798_elicit_23.wav	atemwa amabumba ayabukapepa bengaitila abene nge senge ukushintilila pa bupilibulo bwe shiwi lye senge ngantilila fintu lilesontelela kukwakana fimo ifishibikwe
/scratch/skscla001/experiments/datasets/bemgen/audio/17-200916-193611_bem_346_elicit_11.wav	kanshi ngaulefwaya incito isuma muno mu zambia ufwile wasambilila icisungu
/scratch/skscla001/experiments/datasets/bemgen/audio/03-201002-085315_bem_798_elicit_21.wav	lumbula abakashana bali na vera ilyo paskale amufyompele amubyolela na malenda yabwalwa mukanwa
/scratch/skscla001/experiments/datasets/bemgen/audio/01-201002-005539_bem_fb0_elicit_36.wav	lilya balenwa tii janet ashimikila umubiye tonse utwalengele ukuti afyuke ati no kuti
/scratch/skscla001/experiments/datasets/bemgen/audio/03-201001-105646_bem_798_elicit_23.wav	amangalo yakukosha umubili
/scratch/skscla001/experiments/datasets/bemgen/audio/01-201005-230705_bem_fb0_elicit_12.wav	pati papite umulungu umbi fyamona imicila e iputawikeko amolu nayashala
/scratch/skscla001/experiments/datasets/bemgen/audio/03-201006-013752_bem_798_elicit_41.wav	elyo apunka ku cibi kuti asangafye anatole natambalala ne mpumi ikashike na cee ku mulopa
/scratch/skscla001/experiments/datasets/bemgen/audio/01-200918-072441_bem_d31_elicit_0.wav	bushe nga cakuti shikulu atwita mukumubombela kuti twaipela kukumukonka ukusha bwikashi bwesu ubusuma
/scratch/skscla001/experiments/datasets/bemgen/audio/01-200917-223740_bem_d31_elicit_41.wav	yohane afumine kuli bene no kubwelela ku yerusalemu
/scratch/skscla001/experiments/datasets/bemgen/audio/03-201007-022920_bem_798_elicit_31.wav	basanga nokuti cintu calinga saana shamitombo nga ni mfumu uko afuma ukuti aye asunge caalo cakwe bwinobwino
/scratch/skscla001/experiments/datasets/bemgen/audio/01-180101-042805_bem_d31_elicit_24.wav	ifyabupe fya mupashi
/scratch/skscla001/experiments/datasets/bemgen/audio/03-201002-051828_bem_798_elicit_34.wav	kufyo cikaba kuli mwebabomfi nga mwakota
/scratch/skscla001/experiments/datasets/bemgen/audio/03-200924-200908_bem_798_elicit_32.wav	nalimo kuli nganga iilemubuka iilefwayo kumupeela umulandu pamo na matipu
/scratch/skscla001/experiments/datasets/bemgen/audio/03-201007-015856_bem_798_elicit_64.wav	nomba uku nako atinta na shamitombo pa mukoshi apunda ka viloto umutima nomba wacisa
/scratch/skscla001/experiments/datasets/bemgen/audio/03-200916-033028_bem_798_elicit_38.wav	ne fikulwa fya kwa kashobwe nakwa mpweto tafikokola ukupwa pantu abene beka balayako balafilengula
