audio	sentence
/scratch/skscla001/experiments/datasets/bemgen/audio/01-180101-023953_bem_d31_elicit_33.wav	calicitike bushiku bumo mu mushi uwaleitwa kibari icakuti shikulu bantu uwe shina lya bauleni asangile umupeto wa ku motoka yakwe takuli
/scratch/skscla001/experiments/datasets/bemgen/audio/01-201001-234513_bem_fb0_elicit_32.wav	uyu mulumendo umutundu wakwe mungoni kabili alishibe icindebele ne cibemba sana
/scratch/skscla001/experiments/datasets/bemgen/audio/01-201013-132016_bem_fb0_elicit_13.wav	tabaninako kabili tabasaila abakalamba balabalesha abati mwilaonaula filyo
/scratch/skscla001/experiments/datasets/bemgen/audio/01-201001-204524_bem_fb0_elicit_11.wav	joni aleta pa right inside
/scratch/skscla001/experiments/datasets/bemgen/audio/01-201012-182347_bem_fb0_elicit_29.wav	abashikwete bakapala bafwile ukuisunga nganshi pa kuposela bakapala imifwi teti balecita icongo
/scratch/skscla001/experiments/datasets/bemgen/audio/03-200921-105818_bem_798_elicit_0.wav	bushe kuti mwaicingilila shani ku bulwele bwa kolonavailasi twenty nineteen
/scratch/skscla001/experiments/datasets/bemgen/audio/03-200924-181036_bem_798_elicit_32.wav	alifililwe ukutwalilila ukutamba pamo no kumfwa iyi miponto
/scratch/skscla001/experiments/datasets/bemgen/audio/01-200929-221342_bem_fb0_elicit_39.wav	pa kucinda jaivi nangu pali abantu abengi banono abalemoneka ne cipaale ukulingana na joni na janet
/scratch/skscla001/experiments/datasets/bemgen/audio/01-201011-234841_bem_fb0_elicit_17.wav	ici cifi ici cafye ici candi ine ndi katyetye musanta kulu
/scratch/skscla001/experiments/datasets/bemgen/audio/03-201002-085315_bem_798_elicit_32.wav	nico amwene ifya lecitika ku matundashi
/scratch/skscla001/experiments/datasets/bemgen/audio/01-201011-223928_bem_fb0_elicit_27.wav	nga bayapona mu tulo tekwakwishiba nelyo bucele nga tulumendo natulaba na ku kukosha umulilo pa nsaka
/scratch/skscla001/experiments/datasets/bemgen/audio/01-200917-223740_bem_d31_elicit_23.wav	umulimo wa bacilolo kucingililo mumfwano pamo no kusanguka kwa mweo ne mipepele ya batetekela
/scratch/skscla001/experiments/datasets/bemgen/audio/01-200918-132008_bem_d31_elicit_12.wav	efyo yohane na dabidi baikele no kulabomba ukwabula ukulanda
/scratch/skscla001/experiments/datasets/bemgen/audio/03-201002-093346_bem_798_elicit_11.wav	bushe ubwana nyina cinshi
/scratch/skscla001/experiments/datasets/bemgen/audio/01-201006-112930_bem_fb0_elicit_34.wav	elyo asosa ku fyuni fyonse ati bushe nomba ndepela ani aya masako
/scratch/skscla001/experiments/datasets/bemgen/audio/01-201011-223928_bem_fb0_elicit_2.wav	atemwa mung'ang'a nshi
/scratch/skscla001/experiments/datasets/bemgen/audio/01-200918-112337_bem_d31_elicit_1.wav	nalishishiba nasho shilankonka
/scratch/skscla001/experiments/datasets/bemgen/audio/01-200917-202141_bem_d31_elicit_27.wav	tamwaba umuntu uwalinga ukwita umutwe
/scratch/skscla001/experiments/datasets/bemgen/audio/03-200924-214522_bem_798_elicit_5.wav	no mufungilo wacibukisho walemblwe mu cinso cakwe kubaletina imfumu no kucindika ishina lyakwe
/scratch/skscla001/experiments/datasets/bemgen/audio/03-200925-043821_bem_798_elicit_25.wav	limbi ilyo twaumfwa ubunte naimwe bene lesa kuti acita cimo cine
/scratch/skscla001/experiments/datasets/bemgen/audio/01-180102-181703_bem_d31_elicit_32.wav	kumfwaa imfumu ba mpezeni balilondolola efyo balebomba mukumona ukutila abantu balakonka inshila sha bumi
/scratch/skscla001/experiments/datasets/bemgen/audio/03-200924-181036_bem_798_elicit_42.wav	cacine umuntu uwasambilila icebo cakwa lesa mwi sukulu kuti aafwilisha mu mulimo wakwa lesa nga cakuti amatontonkanyo yakwe yali pali lesa
/scratch/skscla001/experiments/datasets/bemgen/audio/03-201006-013752_bem_798_elicit_19.wav	bushe walishiba abantu abo baula ba mangala
/scratch/skscla001/experiments/datasets/bemgen/audio/01-201006-093742_bem_fb0_elicit_9.wav	alikwata imifwi iya bulembe iyo alashilako inama na ifwe nga akumona nga akulasa no mufwi wa musango uyu nangu wakucembula fye
/scratch/skscla001/experiments/datasets/bemgen/audio/03-201006-021353_bem_798_elicit_12.wav	baiminefye ibumba ilikulu eyefilya
/scratch/skscla001/experiments/datasets/bemgen/audio/03-200921-112400_bem_798_elicit_8.wav	ukupatikisha nobunkalwe mukupanga icupo kupekanishiwa ukucitikila ku muntu umbi ukwabula ukuti asumine
/scratch/skscla001/experiments/datasets/bemgen/audio/03-200916-040939_bem_798_elicit_33.wav	tata mulibabufi tamundetele impila mwandaile
/scratch/skscla001/experiments/datasets/bemgen/audio/01-201002-003945_bem_fb0_elicit_20.wav	e mukuti inshita yonse ii muleyaikala ku wetingilumu ku citesheni
/scratch/skscla001/experiments/datasets/bemgen/audio/01-200929-215409_bem_fb0_elicit_37.wav	ati kafikenipo mukwai natotele sana pa kungafwa ukupompe ncinga
/scratch/skscla001/experiments/datasets/bemgen/audio/01-180101-023548_bem_d31_elicit_37.wav	ine ili line ndelemba ili lyashi ninshingwana no bwafya ubwakuti bushe ntwalilile no bupyungishi bwandi nangu ndeke
/scratch/skscla001/experiments/datasets/bemgen/audio/03-200924-222234_bem_798_elicit_50.wav	na imwe kanshi mwaba abaitumika bushe tamufwile ukulosha mulimo uyo
/scratch/skscla001/experiments/datasets/bemgen/audio/17-200916-193611_bem_346_elicit_26.wav	ndolesheni
/scratch/skscla001/experiments/datasets/bemgen/audio/03-200924-200908_bem_798_elicit_13.wav	nakalya inshita shalipilibuka
/scratch/skscla001/experiments/datasets/bemgen/audio/03-200915-234914_bem_798_elicit_25.wav	ngatatulembele mu cibemba pali bena ni bani bambi abakalemba pali bena
/scratch/skscla001/experiments/datasets/bemgen/audio/01-180102-181703_bem_d31_elicit_23.wav	ba innocent kolala ba director corporate affairs
/scratch/skscla001/experiments/datasets/bemgen/audio/01-201006-002700_bem_fb0_elicit_15.wav	ashifuma fye apooka ulwa kantu ayakungula abakashi na bamwane balima ulwa kulima balaya fye iciyeyeye
/scratch/skscla001/experiments/datasets/bemgen/audio/03-200916-010158_bem_798_elicit_10.wav	kuli bakafundisha babo abanabo elo ne fya mucalo ifileta amano
/scratch/skscla001/experiments/datasets/bemgen/audio/01-201005-222019_bem_fb0_elicit_16.wav	baguni na banshimu baikele ifyo fine baleumfwana
/scratch/skscla001/experiments/datasets/bemgen/audio/17-200916-192637_bem_346_elicit_48.wav	alitemwisha ubulimi
/scratch/skscla001/experiments/datasets/bemgen/audio/03-200925-062606_bem_798_elicit_19.wav	kuti cawama ukwishibisha bamunyina ne nkashi ukupitila muli ci citabo pakuti baisa sangwako
/scratch/skscla001/experiments/datasets/bemgen/audio/03-201006-021353_bem_798_elicit_44.wav	ebele ine ndi mukaya saana na ba mangala
/scratch/skscla001/experiments/datasets/bemgen/audio/01-201012-183344_bem_fb0_elicit_22.wav	takuli nelyo umo uwakulya kapala nelyo icisombwa nga ekele pa cibolya
/scratch/skscla001/experiments/datasets/bemgen/audio/01-201011-225826_bem_fb0_elicit_4.wav	muli aka kambe abaleyangala kuti bashinguluka mu mulongo balepapikana babilibabili umo kuntanshi umbi kunuma pa ncende imo epo babika batatu
/scratch/skscla001/experiments/datasets/bemgen/audio/03-201002-051828_bem_798_elicit_39.wav	ulwambo lupemba cibinda
/scratch/skscla001/experiments/datasets/bemgen/audio/01-180101-223427_bem_d31_elicit_42.wav	mu myeshifye iyakupenda balikwete ibumba lya bantu ilyalinga
/scratch/skscla001/experiments/datasets/bemgen/audio/01-200918-082418_bem_d31_elicit_25.wav	mwipifye kusosa fye pali amaminute yasano nelyo ukucefyako
/scratch/skscla001/experiments/datasets/bemgen/audio/01-200918-090125_bem_d31_elicit_16.wav	ngacakuti onse alemoneka uwasekela pali ici bushe kuti catupamfya ukucilandapo
/scratch/skscla001/experiments/datasets/bemgen/audio/03-201007-004908_bem_798_elicit_49.wav	awe cikapose nshita
/scratch/skscla001/experiments/datasets/bemgen/audio/13-201009-113828_bem_40e_elicit_4.wav	we lukose lwakomfamina ukwikasha we upita ngo mwafi watukwa
/scratch/skscla001/experiments/datasets/bemgen/audio/03-200924-200908_bem_798_elicit_19.wav	paulo alelondolola apabuta ukuti
/scratch/skscla001/experiments/datasets/bemgen/audio/03-200924-204525_bem_798_elicit_8.wav	cinshi cingamulenga ukukwata isenge
/scratch/skscla001/experiments/datasets/bemgen/audio/01-201013-134137_bem_fb0_elicit_15.wav	nomba kena pa kumfwa icongo kebele kandeya kapupila kanaka fye
/scratch/skscla001/experiments/datasets/bemgen/audio/03-201004-091537_bem_798_elicit_19.wav	e pakulaye cilayo bebele nga twalwishe nkondo na imwe ninshi ubweni bwenu bwapwa mwaba muli bakaya bape
/scratch/skscla001/experiments/datasets/bemgen/audio/01-200922-000917_bem_d31_elicit_37.wav	nangu ukulolesha icintu icikalamba
/scratch/skscla001/experiments/datasets/bemgen/audio/01-200930-081904_bem_fb0_elicit_27.wav	akasungu kamweba ukubika mu gear wa bumo
/scratch/skscla001/experiments/datasets/bemgen/audio/01-200918-130145_bem_d31_elicit_49.wav	cilya fye atendeka ukubomba kwaishile umwaice wakwe dabidi
/scratch/skscla001/experiments/datasets/bemgen/audio/01-180101-045438_bem_d31_elicit_10.wav	musumba nshi ukwafumine abakalamba balile pamo na paulo
/scratch/skscla001/experiments/datasets/bemgen/audio/01-180101-020249_bem_d31_elicit_13.wav	ukupyungila abantu bonse
/scratch/skscla001/experiments/datasets/bemgen/audio/01-201001-204524_bem_fb0_elicit_10.wav	pa four koloko ba ndola na ba mufulira abe tiimu lya pa kubala baponenamo mu cibansa
/scratch/skscla001/experiments/datasets/bemgen/audio/03-201004-001734_bem_798_elicit_33.wav	nga kanshi mwe bantu cine lubali kuti mwalwa na banga
/scratch/skscla001/experiments/datasets/bemgen/audio/03-201006-005222_bem_798_elicit_29.wav	ukwafiseme ku ciibwe amona balakakula ifyo baishile nafyo
/scratch/skscla001/experiments/datasets/bemgen/audio/01-201011-231356_bem_fb0_elicit_17.wav	uwasooka iyakumanina e wabalilapo ukuta
/scratch/skscla001/experiments/datasets/bemgen/audio/01-201004-193949_bem_fb0_elicit_1.wav	ico imfubu yapatila abantu ico thila ne filyo fyabo
/scratch/skscla001/experiments/datasets/bemgen/audio/01-200917-185936_bem_d31_elicit_26.wav	uli no kubelenga na fimbi pamulandu wa kubomba kwa uyu magazini pampela yauko
/scratch/skscla001/experiments/datasets/bemgen/audio/03-201007-011712_bem_798_elicit_24.wav	ala mukwai imfumu tepakutemwa yatemenweicibi
/scratch/skscla001/experiments/datasets/bemgen/audio/03-200916-040939_bem_798_elicit_6.wav	icisunga menso efilande fikolwe fyesu
/scratch/skscla001/experiments/datasets/bemgen/audio/01-201006-112930_bem_fb0_elicit_6.wav	lesa mukulu bushe bonse kuti bakupatila fye pa busuma bobe bwekabweka fye
/scratch/skscla001/experiments/datasets/bemgen/audio/01-201002-000224_bem_fb0_elicit_21.wav	janet naleti kuti wakalipa nga nakweba ica cishinka
/scratch/skscla001/experiments/datasets/bemgen/audio/15-201009-114723_bem_40e_elicit_4.wav	kanshi ulya mubili nomba teti ubombe umulimo umbi uo walebomba kale
/scratch/skscla001/experiments/datasets/bemgen/audio/01-200922-110537_bem_d31_elicit_12.wav	nakabili tuletotela abena kristu muno zambia abatupandako amano mufyo batulembela
/scratch/skscla001/experiments/datasets/bemgen/audio/03-201006-002050_bem_798_elicit_1.wav	lyati sukulu lipwe shamitombo taakokwele na kumushi iyoo
/scratch/skscla001/experiments/datasets/bemgen/audio/13-201009-112851_bem_40e_elicit_19.wav	efyo pali na pali kalambo pene
/scratch/skscla001/experiments/datasets/bemgen/audio/03-201004-122608_bem_798_elicit_10.wav	amalumo kuu beshile nabapangwilalye limo pakwisa beshile balecinda na malaila
/scratch/skscla001/experiments/datasets/bemgen/audio/01-201005-234215_bem_fb0_elicit_1.wav	umuntu umo ali mulunshi wa mbwa alelunga utunama twa mu mpanga
/scratch/skscla001/experiments/datasets/bemgen/audio/03-201002-091908_bem_798_elicit_28.wav	pakumulanga ukuti nomba incite aingilamo  iya buna cifyashi yakosafye nga ukuninina umuti naulosha umutwe panshi
/scratch/skscla001/experiments/datasets/bemgen/audio/01-200930-154723_bem_fb0_elicit_13.wav	cilia umusungu atalala joni aisafumya na e eighty mu cola cakwe amutambika
/scratch/skscla001/experiments/datasets/bemgen/audio/01-180101-031630_bem_d31_elicit_39.wav	inshila shimo ishakucimfishamo ulubembu pa lukuta nishi
/scratch/skscla001/experiments/datasets/bemgen/audio/01-201006-002700_bem_fb0_elicit_29.wav	umuntunse ati mukwai soseni fyonse ifyo muleiwaya pantu nimwe mwampela umweo amubula imwe na fyonse ifyo nakwata nga fyashala
/scratch/skscla001/experiments/datasets/bemgen/audio/03-200921-162447_bem_798_elicit_26.wav	umubele wakwe uwabwanakashi nangu ubwaume
/scratch/skscla001/experiments/datasets/bemgen/audio/01-200914-185607_bem_d31_elicit_43.wav	naima ubulendo bwakuya ku kalale
/scratch/skscla001/experiments/datasets/bemgen/audio/03-200925-061220_bem_798_elicit_17.wav	oohoo walishiba palwa mimana
/scratch/skscla001/experiments/datasets/bemgen/audio/01-201011-224854_bem_fb0_elicit_2.wav	limbi kuti abalumendo bacita beka abakashana naba beka ukulingana nefyo balefwaya
/scratch/skscla001/experiments/datasets/bemgen/audio/01-201001-204524_bem_fb0_elicit_3.wav	janet te pa kutemwa ayasamba na bwangubwangu abwela alafwala na busakabusaka
/scratch/skscla001/experiments/datasets/bemgen/audio/03-201004-103454_bem_798_elicit_35.wav	ninshi baleya cinda saana ubo bushiku
/scratch/skscla001/experiments/datasets/bemgen/audio/08-200915-143450_bem_346_elicit_22.wav	iyi filimu ibomfya utumitwe utwamalangi ayengi
/scratch/skscla001/experiments/datasets/bemgen/audio/01-200918-113920_bem_d31_elicit_19.wav	kuti twatwala shani ifisabo
/scratch/skscla001/experiments/datasets/bemgen/audio/01-200930-081904_bem_fb0_elicit_44.wav	lelo pa kushininkisha alanda amanshoko ati bushe ubwinga bwenu bukabako lilali
/scratch/skscla001/experiments/datasets/bemgen/audio/03-201003-235942_bem_798_elicit_37.wav	amato kuti waluba nelyo yapindulwike
/scratch/skscla001/experiments/datasets/bemgen/audio/01-200929-221342_bem_fb0_elicit_4.wav	janet nelyo ali fye umukashana uwamulenga abo baleyangala nankwe ku lusaka balimusambilishe imisango ya buwelewele ilya pa cina tauni batila bukapenta
/scratch/skscla001/experiments/datasets/bemgen/audio/01-201013-134137_bem_fb0_elicit_13.wav	kaesha ukufumako kafilwa cakosa fye ndi
/scratch/skscla001/experiments/datasets/bemgen/audio/01-180102-143243_bem_d31_elicit_12.wav	ubwasakamana abapina mu caalo bulebomba mu luwingu
/scratch/skscla001/experiments/datasets/bemgen/audio/01-200921-192247_bem_d31_elicit_41.wav	bushe mucita shani nga muli no mulimo uucilile amaka yenu kabili nimwe fye mwishibe ifyakuubomba bwino
/scratch/skscla001/experiments/datasets/bemgen/audio/03-200915-234914_bem_798_elicit_0.wav	cila cintu caliba ne nshita
/scratch/skscla001/experiments/datasets/bemgen/audio/03-201001-105646_bem_798_elicit_15.wav	nati nokuti awe ciine ilyo bali abalumendo nenkoko shalepelakwali  akantu nakabiye
/scratch/skscla001/experiments/datasets/bemgen/audio/01-200917-132419_bem_d31_elicit_23.wav	balingile ukwibukisho kutila bena pamonge misambo balingile ukuba muli yesu
/scratch/skscla001/experiments/datasets/bemgen/audio/01-200930-154723_bem_fb0_elicit_4.wav	joni ati pembeleni mwacimona mailo imwe mutila nalimebepa mwa
/scratch/skscla001/experiments/datasets/bemgen/audio/03-200916-125910_bem_798_elicit_19.wav	niwe shiwailiwa uonta ubuta bwakwe
/scratch/skscla001/experiments/datasets/bemgen/audio/03-200920-120041_bem_798_elicit_44.wav	takwaba umuti wa bulwele bwa kolonavailasi nineteen
/scratch/skscla001/experiments/datasets/bemgen/audio/03-201004-110412_bem_798_elicit_14.wav	alesunta nokusunta
/scratch/skscla001/experiments/datasets/bemgen/audio/03-201007-004908_bem_798_elicit_43.wav	nomba impapa shalimufuma pa mubili
/scratch/skscla001/experiments/datasets/bemgen/audio/03-200924-222234_bem_798_elicit_20.wav	umu ni mu mikalile yabo muli yesu kristu
/scratch/skscla001/experiments/datasets/bemgen/audio/01-200922-000917_bem_d31_elicit_10.wav	cila ishiwi neshina balililondolola
/scratch/skscla001/experiments/datasets/bemgen/audio/03-200925-043821_bem_798_elicit_31.wav	ukuba bamembala bapimpa mu cilonganino ca christian brethren church nangu icilonganino cimbi ica evangelical church ica ishibikwa
/scratch/skscla001/experiments/datasets/bemgen/audio/01-201012-190124_bem_fb0_elicit_3.wav	baisa kafyantika na mukati ke liba bateya kwati lukose iliba nomba lyashala naliminina
/scratch/skscla001/experiments/datasets/bemgen/audio/03-200921-171929_bem_798_elicit_7.wav	ukutinya abaice
/scratch/skscla001/experiments/datasets/bemgen/audio/01-180101-020137_bem_d31_elicit_41.wav	tulingile ukutontonkanya pa kulundapo te kwikalafye ne fishima fyakale
/scratch/skscla001/experiments/datasets/bemgen/audio/01-201006-105203_bem_fb0_elicit_31.wav	abantu abati kuli ci we mwaume na lelo
/scratch/skscla001/experiments/datasets/bemgen/audio/03-200921-114142_bem_798_elicit_5.wav	ba kapokola mu calo ca australia bantu abasuma kabili abacetekelwa
/scratch/skscla001/experiments/datasets/bemgen/audio/03-201002-063230_bem_798_elicit_34.wav	lumbula amafunde yasano ayo balefunda mu calici ilyo pio aile mukusalika pa nshiku yamulungu
/scratch/skscla001/experiments/datasets/bemgen/audio/01-180101-045438_bem_d31_elicit_13.wav	bwafya nshi ubo ulukuta lwa ntanshi bwa shingwene nabo
/scratch/skscla001/experiments/datasets/bemgen/audio/01-201012-184652_bem_fb0_elicit_22.wav	kuti baseba icikalamba ukulingana nomo balefwaila
/scratch/skscla001/experiments/datasets/bemgen/audio/03-201006-025003_bem_798_elicit_38.wav	na bantu mu mushi aabak wete ubwalwa baleta kwa wongo kwine eko balanwena
/scratch/skscla001/experiments/datasets/bemgen/audio/01-201001-231632_bem_fb0_elicit_32.wav	pa nshita ii ninshi ulya cilumendo umundebele bafyuka kale aleti nalelo nalalungwa
/scratch/skscla001/experiments/datasets/bemgen/audio/01-200922-004748_bem_d31_elicit_10.wav	imisepela yalayamba ukusambilila palwa kuteka inkoko
/scratch/skscla001/experiments/datasets/bemgen/audio/03-201006-025003_bem_798_elicit_0.wav	atekele ne hotela ilikalamba saana
/scratch/skscla001/experiments/datasets/bemgen/audio/01-200930-150533_bem_fb0_elicit_3.wav	ulya mukashana ni cibusa wandi kabili mfwaya ukuti nkamuupe kanshi tacilingile ukuti na iwe ulemupempula watesha ngoli mwana wa muntu
/scratch/skscla001/experiments/datasets/bemgen/audio/01-201006-002700_bem_fb0_elicit_17.wav	taumwene mune ala twakupususha balya wamona tababwele ilya ine e mille nabaya
/scratch/skscla001/experiments/datasets/bemgen/audio/03-201007-015856_bem_798_elicit_19.wav	abantu bakonkeleko cabapeseshe na maano pakumono kuti akaice kaikate cinama cishaikulila
/scratch/skscla001/experiments/datasets/bemgen/audio/01-180101-062208_bem_d31_elicit_47.wav	mfwile nafwa icakubafwilisha mfwile nasanga indyabuluba bwangu bwangu
/scratch/skscla001/experiments/datasets/bemgen/audio/03-201004-113233_bem_798_elicit_23.wav	mukolo nga alifwa clyo bamupeela uwamukonkapo
/scratch/skscla001/experiments/datasets/bemgen/audio/01-201011-231356_bem_fb0_elicit_19.wav	na pa kwikala ifyo fine emo bakonkanina mpaka bonse bashinguluka icilindi
/scratch/skscla001/experiments/datasets/bemgen/audio/01-201012-180720_bem_fb0_elicit_0.wav	nomba nga shafuma shonse  ninshi shasandana
/scratch/skscla001/experiments/datasets/bemgen/audio/01-201001-172058_bem_fb0_elicit_10.wav	janet ati ateshe umusowa wa citukutuku washimina mupepi aisafumina panse amona ni joni uyu aleisa
/scratch/skscla001/experiments/datasets/bemgen/audio/03-201007-011712_bem_798_elicit_14.wav	elyo alundapo no kutila icuma cinecine cintu akanonka mukashi kumfwa maria nga asumina ukuti akamuupe
/scratch/skscla001/experiments/datasets/bemgen/audio/01-200929-215409_bem_fb0_elicit_19.wav	joni mukwai abana ba muno mufurila eco ibulenga kulowa batini efyo bafulunganya inshina lyandi
/scratch/skscla001/experiments/datasets/bemgen/audio/01-201001-172058_bem_fb0_elicit_9.wav	kanshi ashile acimika mumbali ya musebo mupepi ne cipata elyo aingila
/scratch/skscla001/experiments/datasets/bemgen/audio/01-201004-205737_bem_fb0_elicit_29.wav	wena kuti nga aya ku kunwapo alenunshapo fye
/scratch/skscla001/experiments/datasets/bemgen/audio/01-201013-132016_bem_fb0_elicit_42.wav	kanshi kuti uyu acita pa kape abatwalila noyu nao ifyo fine bacila na bacikwata abacilacenwa ne fisonsonkoto
/scratch/skscla001/experiments/datasets/bemgen/audio/01-200918-120021_bem_d31_elicit_15.wav	eico tulesubila ukuti bakabelenga ukufuma ku nkuta shimbi bakulatwelelako mu nshita ilyo twalanda pa mulandu umo uukuminefye amabumba ya filonganino fyesu
/scratch/skscla001/experiments/datasets/bemgen/audio/03-200925-062606_bem_798_elicit_9.wav	akabungwe kesu kamona ukutila nelyo amasambililo ayengi kuti yabomba ukwafwilisha abena kristu ba mu nkuta shonse
/scratch/skscla001/experiments/datasets/bemgen/audio/01-180101-023548_bem_d31_elicit_27.wav	ajith fernando pa kubomfya amashiwi yakwa henri nouwen atile
/scratch/skscla001/experiments/datasets/bemgen/audio/01-201011-231356_bem_fb0_elicit_16.wav	pa kutendeka kuti babika imisepe mu cilindi elyo balasooka
/scratch/skscla001/experiments/datasets/bemgen/audio/01-201011-223928_bem_fb0_elicit_17.wav	elyo abafine ndimi baleluba na pa kusosa balebaseka
/scratch/skscla001/experiments/datasets/bemgen/audio/03-200925-043821_bem_798_elicit_33.wav	ukulundapofye pacishinka cakuti ifilengo fyabo fikalaendelapamo na mashina yabo ifilambu fimbi fikalipilwa mu mulu
/scratch/skscla001/experiments/datasets/bemgen/audio/03-200924-200908_bem_798_elicit_14.wav	mu cipingo ca kale mupashi wa mushilo aleikalafye pa ntungulushi ishalesontwa
/scratch/skscla001/experiments/datasets/bemgen/audio/03-200921-160552_bem_798_elicit_0.wav	umutitikisha wamu ndupwa namu mayanda
/scratch/skscla001/experiments/datasets/bemgen/audio/03-201004-001734_bem_798_elicit_21.wav	awe mukwai cabula na bulole
/scratch/skscla001/experiments/datasets/bemgen/audio/01-201004-205737_bem_fb0_elicit_53.wav	we mwana ifyo namwafwile ulya muntunse e wancita umusango uno
/scratch/skscla001/experiments/datasets/bemgen/audio/01-180101-031630_bem_d31_elicit_0.wav	mukwipifya ubwelelo kulekelelwa nangu luse luntu umuntu uulufyenye apokelela panuma ya kupapata
/scratch/skscla001/experiments/datasets/bemgen/audio/01-200917-202141_bem_d31_elicit_11.wav	takwabo muntu uwamano uwingekatila cishibilo nelyo alemona cintu cine cine
/scratch/skscla001/experiments/datasets/bemgen/audio/03-200916-015847_bem_798_elicit_26.wav	akamuti ukwete eko bominako insoka nangu imbwa
/scratch/skscla001/experiments/datasets/bemgen/audio/03-200925-053533_bem_798_elicit_16.wav	mulalikeni ukulasangwa kukulongana ukuli konse elyo no kumutandalila mukwangufyanya
/scratch/skscla001/experiments/datasets/bemgen/audio/01-201002-003945_bem_fb0_elicit_12.wav	shimona we nkashi yandi iwe ifyo ucindeme neco uli pa bukulu
/scratch/skscla001/experiments/datasets/bemgen/audio/03-200924-204525_bem_798_elicit_47.wav	ifwe bonse tufwiletwasekesha umwina mupalamano ku busuma bwakwe ku kumukula
/scratch/skscla001/experiments/datasets/bemgen/audio/01-201001-201528_bem_fb0_elicit_38.wav	janet aileposa amano ku kalumendo kamo ifi aka ndebele
/scratch/skscla001/experiments/datasets/bemgen/audio/03-200916-015847_bem_798_elicit_18.wav	te mushi onse uwisa mu nsaka
/scratch/skscla001/experiments/datasets/bemgen/audio/01-180101-120903_bem_d31_elicit_42.wav	bushe cinshi mwakwatila ubukaka bwamusango uyu kanshi
/scratch/skscla001/experiments/datasets/bemgen/audio/01-180101-120903_bem_d31_elicit_44.wav	mayo senge amano yamusango ifi ecilenga ukuti abaice bayamba ukulufya umucinshi
/scratch/skscla001/experiments/datasets/bemgen/audio/03-201004-001734_bem_798_elicit_9.wav	baisapasangana kuti na bali ku mulundu babensela kumo
/scratch/skscla001/experiments/datasets/bemgen/audio/01-201005-224141_bem_fb0_elicit_8.wav	cilya bapwa ukuteya bapita mumbali bayakumanina kuntanshi balasokwela ne sabi ku masumbu
/scratch/skscla001/experiments/datasets/bemgen/audio/03-201001-100406_bem_798_elicit_39.wav	bonse pamushi pacaani taba ishibe insala emukutila lyonse baleeba abaikuta mulusuba namainsa kumo
/scratch/skscla001/experiments/datasets/bemgen/audio/01-200922-110537_bem_d31_elicit_37.wav	ukulongana kwa bakwilula mu cibemba na mu cingeleshi mu mulimo wa natuleya magazini ukwapekanishiwe na ba obed mwape
/scratch/skscla001/experiments/datasets/bemgen/audio/01-201006-105203_bem_fb0_elicit_7.wav	ukwile imbwili umumbulu ulubwabwa taiga ne nama shonse ishikali shayaumfwa amashiwi ya musango umo wine
/scratch/skscla001/experiments/datasets/bemgen/audio/03-201006-002050_bem_798_elicit_20.wav	awe na mukenda na kaitali abali nokukanya bashumfwefyo bebele twashuka nomba no bufumu bwine twalila twapoka
/scratch/skscla001/experiments/datasets/bemgen/audio/03-201002-051828_bem_798_elicit_1.wav	ulubuli teelo nemisoka yonse yakutaluka saana
/scratch/skscla001/experiments/datasets/bemgen/audio/03-201002-054811_bem_798_elicit_27.wav	bambukile icaletele iciwa awe  casangwa ati kupula mwifunde nefintu fimbi awe twatwala ifyakufuta neciwa caya
/scratch/skscla001/experiments/datasets/bemgen/audio/03-200925-061220_bem_798_elicit_34.wav	tabalefwayafye imwe ukumona ifyo mwingamoneka bwino mumenshi ayalengama
/scratch/skscla001/experiments/datasets/bemgen/audio/10-200914-180622_bem_346_elicit_26.wav	balilwile pa buntungwa
/scratch/skscla001/experiments/datasets/bemgen/audio/03-201003-235942_bem_798_elicit_34.wav	bamona no mulilo pe shilya ulipo na belubelu mu miti ici paya palefitilila
/scratch/skscla001/experiments/datasets/bemgen/audio/03-200924-200908_bem_798_elicit_36.wav	muli shino nshiku amafya yaleishila mu misango iya lekana lekana
/scratch/skscla001/experiments/datasets/bemgen/audio/03-200916-141341_bem_798_elicit_4.wav	kwenu ni kwikoshi balenda enda wacebako
/scratch/skscla001/experiments/datasets/bemgen/audio/03-201002-051828_bem_798_elicit_32.wav	ngokasambilisha abana bobe atemwa bakaba abantu yawe yawe
/scratch/skscla001/experiments/datasets/bemgen/audio/01-201005-232741_bem_fb0_elicit_10.wav	yaipaya abantu bonse mu mushi mulya cilya bapwa yalungama ne ku musumba wa mfumu
/scratch/skscla001/experiments/datasets/bemgen/audio/01-200922-091556_bem_d31_elicit_24.wav	ciwa atile wilamfyenga
