speaker_id	audio	sentence	duration	gender	gender_domain
1	01-180102-181703_bem_d31_elicit_27.wav	elyo bali kulya kwisano balilanshanya ne mfumu amashiwi aya kankala	5.4	M	1
1	01-200921-235328_bem_d31_elicit_4.wav	yesu aitile nokusonta abaume ikumi limo na babili aba muba yuda ukuba abasambi bakwe ukulingana nabo umwine alefwaya kabili aitile aba bantu ishina lyakutila basambi ne milandu abetile	17.2	M	1
1	01-201001-231632_bem_fb0_elicit_41.wav	lelo abwela icungulo sana no munkoyo takwete kabili alemoneka uwakolwa sana batampa no kumutunganya	8.24	M	1
1	01-180101-223427_bem_d31_elicit_39.wav	tacali icayanguka ukufuma mukucingililwa uko baishibe nga bashimapepo ba cilonganino icashimpilwe mu mushi lelo baumfwile ukuti balingilefye ukuya	12.25	M	1
1	01-201012-184652_bem_fb0_elicit_4.wav	nalabalilapo ukulondolola amaliba ya tuni	3.88	M	1
1	01-201002-003945_bem_fb0_elicit_14.wav	janet amwentulako fye alasuba kondakita kilishi ati	5.83	M	1
1	01-201013-141625_bem_fb0_elicit_36.wav	ifyo fine balengula yonse yapwa balabwelela na ku mushi	4.51	M	1
1	01-200914-194432_bem_d31_elicit_49.wav	ine nacilamona kwati ni ndalama ulendetela	3.18	M	1
1	01-200921-235328_bem_d31_elicit_24.wav	icabutatu umutande wakukanshishamo	3.2	M	1
1	01-201006-093742_bem_fb0_elicit_0.wav	ico imbwa yaikalila na bantu	2.72	M	1
1	01-200929-221342_bem_fb0_elicit_31.wav	kuti balafika pa tebulo joni alalangilila janet ku babiye ati bane uyu tuli nankwe ni miss janet phiri cibusa wandi	10.53	M	1
1	01-201002-011519_bem_fb0_elicit_29.wav	abalumendo ba uno mwaka tabomfwa	3.86	M	1
1	01-201002-000224_bem_fb0_elicit_26.wav	janet apo enamine fye panshi aleyalaula ne minwe	4.42	M	1
1	01-200918-082418_bem_d31_elicit_2.wav	twebeni ifyacitika mu mweo wenu	2.22	M	1
1	01-180101-213930_bem_d31_elicit_40.wav	mose ndesubila mubukali pamulandu wa bantu abashaiswileomo namatotelo acitile ngo waishibe ukucila lesa icalefwaikwa ukucita	13.39	M	1
1	01-201006-112930_bem_fb0_elicit_35.wav	ifyuni fyonse fyatendeka ukupunda icili apa nine nine lesa alefilolesha fye	7.03	M	1
1	01-201002-002057_bem_fb0_elicit_12.wav	ine nati aleseka fye kanshi cinecine	3.7	M	1
1	01-200918-110012_bem_d31_elicit_5.wav	nalimo kuti cawama ukubelenge ciputulwa ca malembo nangu mutwe we sambililo nelyo mweo wa muntu umo mu cipingo	7.26	M	1
1	01-200922-004748_bem_d31_elicit_4.wav	umo umwingasakamana no kwishibo bwafya bobe	7.67	M	1
1	01-201001-223110_bem_fb0_elicit_34.wav	cilumendo kanshi sisita ulecula sana pantu ninjishiba uli mwina tauni walitemwa ukutandala no kwangala umo ulefwaila	10.48	M	1
1	01-201001-172058_bem_fb0_elicit_36.wav	janet nakopelwe ku royal art studio ku harare	6.17	M	1
1	01-180101-020958_bem_d31_elicit_46.wav	nefyo ifyalo fyali ni angola congo dr kenya malawi madagascar mozambique nigeria south africa elyo na zambia	12.5	M	1
1	01-201012-193916_bem_fb0_elicit_29.wav	cinecine nga cakuti umukalamba ali fye eka kuti aumfwa ububi no bulanda mu milimo yonse alecita nelyo acincila shani kusuka anenuka	13.61	M	1
1	01-201013-132016_bem_fb0_elicit_22.wav	eico na bantu bamo balaipalanyako pa kulondolola ubukali bwabo abati ine ndi musunga wa mpundu nyambala pamulu	9.23	M	1
10	10-200914-180622_bem_346_elicit_33.wav	namucimona ici icimuti	3.65	M	1
1	01-201005-234215_bem_fb0_elicit_4.wav	bushiku bumo alungile kasuba konse ukwabula ukuti epaye nelyo kamo aipaya fye akalipulu kamo	8.96	M	1
1	01-201001-204524_bem_fb0_elicit_43.wav	awe kanshi mwandi ubufyashi nga e efyo bwalula abantu filya ine teti mbukabile ata see	8.28	M	1
1	01-200922-110537_bem_d31_elicit_15.wav	umwiminishi wesu ku copperbelt alelanshanya nentungulushi sha filonganino mu matauni yonse kulya	7.55	M	1
1	01-200914-200932_bem_d31_elicit_5.wav	nikwisa uleya ulingile walipila iya tiketi	4.29	M	1
1	01-201006-090721_bem_fb0_elicit_39.wav	nakaendi ilyo bwacele ulucelo babtula abanabo bamo babafisa ku mulu wa fimuti baya na ku milimo	9.14	M	1
1	01-201001-195552_bem_fb0_elicit_37.wav	aleti nga atontonkanya icuma joni aleka pali ena ubukulu amona nefyo joni engacula nga cakuti apula mu ifunde lyakwe amukaana	13.23	M	1
1	01-201012-190124_bem_fb0_elicit_21.wav	na yakuti yaleshala fye na masako yekayeka akoni akene nakaya	6.51	M	1
1	01-201012-182347_bem_fb0_elicit_0.wav	abalumendo nga banaka ukuta mu ibeta kuti balata mulambilwa	7.24	M	1
1	01-201005-232741_bem_fb0_elicit_14.wav	ilyo yapwisha ukwipaya abantu bonse nomba yaibika na mu nshila ukukonka ukwaya shikulu wa yako	8.35	M	1
1	01-201002-003945_bem_fb0_elicit_35.wav	kabili baima na peter ukuya ku shitesheni peter aya nasenda icipe cakwa janet	8.51	M	1
1	01-200917-223740_bem_d31_elicit_16.wav	tubalilapo ukwishiba ukuti lesa alintemwa elyo kuba ukumfwa bwino pali kulya kutemwa cibe ninshi ndesangalala pamulandu wa kwelelwa no kupokelelwa	12.09	M	1
1	01-200922-110537_bem_d31_elicit_52.wav	uwangwe cebo ca kwa lesa akasango busuma no utetekela yehoba alipaalwa	5.42	M	1
1	01-201001-225221_bem_fb0_elicit_19.wav	umukashana wa mupampa kuti cilya ashingilila fye amayanda apetusha ne ncinga uyo ku biaolo	9.48	M	1
1	01-200917-132419_bem_d31_elicit_1.wav	uku kukananakila takwasekeshe lesa	3.15	M	1
1	01-180101-143137_bem_d31_elicit_17.wav	ili ifumo lya mweshi umo	2.38	M	1
1	01-180102-143243_bem_d31_elicit_45.wav	kanshi pano tulekula akapatala akanono mini hospital	4.61	M	1
1	01-180101-020249_bem_d31_elicit_25.wav	mataba malasha ne fyumbu cisuma nganshi	5.15	M	1
1	01-201002-011519_bem_fb0_elicit_39.wav	joni nangu pa citukutuku kuti naya ukushili mfula yakuntiinya	5.56	M	1
1	01-200918-120021_bem_d31_elicit_22.wav	na cimbi pali ico magazini wa bena kristu muli cila calo ulekabilwa ifya bupe na fimbipo ukufuma ku bena kristu ba muli ico calo abaipeleshe ukutungilila umulimo wakwa lesa mu kupela	15.79	M	1
1	01-201001-231632_bem_fb0_elicit_40.wav	ababiye kwa janet mu mushi bapapa nganshi pa kumona apo janet abwelela uwaciba atile naya ndafwaya umunkoyo	10.73	M	1
1	01-201012-192322_bem_fb0_elicit_9.wav	pantu abafyashi bonse babili e bali no kumona ifyo umwana onse akaba mu kukula kwakwe	7.19	M	1
1	01-200917-234543_bem_d31_elicit_23.wav	tusambilila pamulandu wa uku kusubwa ilintu yesu akulumbwile muli luka	6.72	M	1
1	01-200918-072441_bem_d31_elicit_16.wav	imitekele isuma yaba mumafunde ya lupapulo ulucingilila insambu no buntungwa bwa bekala calo	8.53	M	1
1	01-180101-120903_bem_d31_elicit_5.wav	cinshi walaipushisha eko mfumine	2.31	M	1
1	01-201004-201313_bem_fb0_elicit_6.wav	icishele yapalama na ku muti wine umuntu alesaila yasosa aiti	7.12	M	1
1	01-201002-013220_bem_fb0_elicit_29.wav	nao abeba ukwisabalondolwela nga bafyashi ba phiri babwela ku ncito	7.12	M	1
1	01-180101-044203_bem_d31_elicit_42.wav	nangula cali cakweba ati twalishingwanako na mafya ayali nga amenshi yakunwa amalaiti ukubikapofye ne ndalama	8.44	M	1
1	01-201012-184652_bem_fb0_elicit_27.wav	nga aseba amona yafula impendwa alefwaya yakumana kuti atendeka ukutuntila pa mubansa	10.8	M	1
1	01-200929-221342_bem_fb0_elicit_2.wav	kanshi ubushiku amwene joni alepante mpila nga ku mashini atampile ukufwaye nshila ya kukumanishamo joni no kulanda nankwe no kucite cibusa nankwe	14.41	M	1
13	13-201009-112851_bem_40e_elicit_5.wav	naipusha bakamukwamba nati bushe amulalya katapa no bowa nga cali shani	6.76	M	1
1	01-200918-130145_bem_d31_elicit_32.wav	mu kuilishanya sembe atile abembuka	3.02	M	1
1	01-200918-090125_bem_d31_elicit_21.wav	afuma ku mikoti ku lukuta afuma niku new life na ku apostolic faith	7.6	M	1
1	01-200914-214639_bem_d31_elicit_12.wav	kuti wasanga bakupoka umwanakashi wakupa	3.27	M	1
1	01-200918-072441_bem_d31_elicit_12.wav	bushe ulupapulo cinshi	2.13	M	1
1	01-200918-072441_bem_d31_elicit_48.wav	nipa milimo ne mibele ya mukati ka ng'anda ifyasuminishiwa nefishilingile mukati ka ng'anda yakwa lesa ifili mu cebo cakwa lesa	10.78	M	1
1	01-180101-213930_bem_d31_elicit_34.wav	mumpwendwa twenty tulesangamo ubutantiko bwa fintu ifyaishile citika panuma yamyaka forty	7.83	M	1
1	01-201006-090721_bem_fb0_elicit_27.wav	kuti bakapanga bashimona fye nakabili ukuti umushi watalala baisafuma babuula ne goma shine bakanga batalika ne ciila	9.96	M	1
1	01-201013-134137_bem_fb0_elicit_33.wav	limolimo ababamfi batuni tabatwala ku mushi balila fye ku mansansa	7.51	M	1
1	01-200918-130145_bem_d31_elicit_28.wav	wishi apukwinye fye umutwe elyo bonse babili baikele tondolo pa nshita iinono	5.29	M	1
1	01-201012-192322_bem_fb0_elicit_26.wav	nomba nga cakuti no twana tunono epo tuli baya mu kutulela batutalusha pali banyinabo pakuti tatulelila nga twamona abafyashi babo mupepi	12.71	M	1
1	01-180101-120903_bem_d31_elicit_44.wav	mayo senge amano yamusango ifi ecilenga ukuti abaice bayamba ukulufya umucinshi	5.31	M	1
1	01-201013-141625_bem_fb0_elicit_44.wav	nga cakuti ku baleipika umo alaba ashamo umuto kuti bamuseka nganshi kabili abengi teti balyemo	7.12	M	1
1	01-200922-003122_bem_d31_elicit_36.wav	shimapepo aebele muke ukufukama pakuti bene bonse babili balombe kabumba uwapulamo ukucito mulimo wakwe	9.26	M	1
1	01-201001-203149_bem_fb0_elicit_22.wav	iwe lolela kuno kwine pakuti umwina mobe umutima ufuuke tulekutwala panuma pantu nga mwaya nankwe alekuuma sana	10.23	M	1
1	01-201011-221153_bem_fb0_elicit_18.wav	nelyo fye uwakulekelesha	2.02	M	1
1	01-200929-223449_bem_fb0_elicit_4.wav	bane natube nga few batalukapo cinono tumone ulya kapooli ifyo aleisacita	7.83	M	1
1	01-200930-150533_bem_fb0_elicit_16.wav	joni akubila ikofi iyapita fye pa mulu wakwe joni aleka na ku ikofi lya ku kuso kuti pa linso kuli peter pokela	10.71	M	1
1	01-180101-045438_bem_d31_elicit_3.wav	pa kutontonkanyakwa mifinine ya iyi ncito ya kusalanganya no kushitisha ulu lupapulo	6.72	M	1
1	01-201011-231356_bem_fb0_elicit_24.wav	pa kutendeka ukwimba no kuta ifyo fine	3.22	M	1
1	01-201001-225221_bem_fb0_elicit_1.wav	ici caletele joni insansa ishingi nganshi pantu alefwaisha ukukwata umwana	5.04	M	1
1	01-180101-023548_bem_d31_elicit_3.wav	ilyo tufwailisha pabwikalo bwakwa yesu maka maka mu fitabo fya mbila nsuma	8.6	M	1
1	01-200914-194432_bem_d31_elicit_9.wav	mwilaba mukwa natotela saana	3.04	M	1
1	01-201005-232741_bem_fb0_elicit_24.wav	nomba uko ayasha ku buko bwakwe pali umuntu umo uwayatumine afililwe no kuyakonsa	9.07	M	1
1	01-200930-081904_bem_fb0_elicit_46.wav	joni nga mulandu nshi walenga ukuti ukane ukukobekelwa we mukashana wacindama ifi	6.51	M	1
1	01-201006-110929_bem_fb0_elicit_54.wav	lesa mukulu nga kanshi finshi afukanya	3.86	M	1
1	01-180101-023953_bem_d31_elicit_6.wav	nga twaikalilila mu fikansa ninshi teti twimbe na fimbi ifishima elyo ne fyaimbwa akale na fyo filefwa	8.26	M	1
1	01-201001-193222_bem_fb0_elicit_39.wav	mwana wandi talinga kusangulo mubemba epali nga mwaya nankwe ku lubemba wayamupatikisho kuniina ku miti na bwanakashi	10.19	M	1
1	01-201005-224141_bem_fb0_elicit_56.wav	cimo catontonkanya aciti kanjemona kulya kuntu twashile amasumbu yesu nalimo kuti nomba isabi lyalikatwa	8.71	M	1
1	01-200922-100107_bem_d31_elicit_35.wav	nga bakakonka abacumfwila twayasuka cilifye natuleya	7.44	M	1
1	01-201012-180720_bem_fb0_elicit_0.wav	nomba nga shafuma shonse  ninshi shasandana	3.43	M	1
1	01-200918-110012_bem_d31_elicit_49.wav	abantu batatu abakacita bwino pali uku kucimfyanya bakapokelelela ifitabo ifisuma nge filambu	6.22	M	1
1	01-200922-102640_bem_d31_elicit_25.wav	ifyo twingasambilila kuli yesu kristu	2.04	M	1
1	01-180101-223427_bem_d31_elicit_30.wav	elyo no buteko tabwakuulileko isukulu nelyo cikuulwa icili conse	4.99	M	1
1	01-180101-023953_bem_d31_elicit_1.wav	pantu twamona kuli isaac pa kwisula no kwimba ifishima ifipya alipakeswe sana	6.1	M	1
1	01-200930-150533_bem_fb0_elicit_34.wav	katwishi apo bambelamine	2.38	M	1
1	01-201013-132016_bem_fb0_elicit_46.wav	ukuba kwena na bakalamba bene balatoola no kusaba baleleta na ku mushi lelo te lingi line bafimina nga baice	10.44	M	1
1	01-201001-225221_bem_fb0_elicit_7.wav	ilyo aleenda alaumfwa insoni ishingi nga amona abantu balemulolesha	6.92	M	1
1	01-201001-172058_bem_fb0_elicit_5.wav	banalume shikutala kanshi mwaleta abenamwenu kuno twaisabamona no kubeshiba	6.92	M	1
1	01-180101-020137_bem_d31_elicit_47.wav	noku kwali ulubuli ne fikansa pa mulandu wa fishima eco konse ukuli ukukansanina pa menshi cibe ku mubili nelyo ku mupashi abantu balaculilamo bonse	15.29	M	1
1	01-200929-223449_bem_fb0_elicit_49.wav	neco joni alebafwa mu twinge balitinine ukumukanya	4.92	M	1
1	01-200917-231428_bem_d31_elicit_13.wav	umulubushi uwasubwa	2.63	M	1
1	01-201011-234841_bem_fb0_elicit_29.wav	nga impeta shili mu ibeta umuntu onse aleshiba ulupeta lwakwe nga lwalya nangu eo balya	10.57	M	1
1	01-200922-093621_bem_d31_elicit_18.wav	muli iyi nshila paulo nga alisuminishiwe ukuya eka mu bufwayo bwakwa lesa	5.81	M	1
1	01-180101-221817_bem_d31_elicit_21.wav	mu fipingo fimo mu cingeleshi balembele nkonto mu kufusha	5.81	M	1
1	01-201006-090721_bem_fb0_elicit_43.wav	bambi batantama no mulengo batampako no lwimbo	5.2	M	1
1	01-200929-221342_bem_fb0_elicit_44.wav	na cine cilia ten minutes apwa ne nyenjele ya kwisala yalila	5.49	M	1
1	01-201013-134137_bem_fb0_elicit_19.wav	kwaliba ne fifulo na fimbi umo twikala utwingi	4.08	M	1
1	01-180101-060018_bem_d31_elicit_37.wav	abantu bambi kuti bamona ukuti iyi magazine taiweme ni pamulandu wakuti tababelenga icipingo cakwa lesa mukulu	9.55	M	1
13	13-201009-112851_bem_40e_elicit_20.wav	mateo nao aipusha ati mwasosa amuti alifwa kanshi uwafwa kuti aisa shani kuli ifwe	8.21	M	1
1	01-201001-231632_bem_fb0_elicit_32.wav	pa nshita ii ninshi ulya cilumendo umundebele bafyuka kale aleti nalelo nalalungwa	7.35	M	1
1	01-201006-090721_bem_fb0_elicit_25.wav	basuuka balala no kulala	2.4	M	1
1	01-201002-005539_bem_fb0_elicit_50.wav	janet mune wesu wiebako nelyo umo ukuti ndi muno lusaka palibufi nga bafyashi bandi	8.51	M	1
1	01-200918-101707_bem_d31_elicit_10.wav	shikaalukila ku fitabo fya scientology mukufwaya icishinka icipingo cikasanguka icafye mu menso shaiko	9.8	M	1
1	01-180101-023548_bem_d31_elicit_50.wav	inshita yakuba fweka na lesa itulenga ukupola na kukunaka ukwa kucila mu cipimo	8.58	M	1
1	01-200918-082418_bem_d31_elicit_21.wav	natubomfye ilyashi lyepusukilo lyesu tulande nokweba abanensu pafyo lesa atucitila mu myeo yesu ukwabula insoni	8.76	M	1
1	01-200918-130145_bem_d31_elicit_37.wav	tata  tata tulemupepelako	2.43	M	1
1	01-201005-230705_bem_fb0_elicit_47.wav	cilya yafika uko ali abuula inondo ayakonsa yaponena na mu isamba lye fwasa ayatola balabwelela na ku mushi	12.55	M	1
1	01-201005-230705_bem_fb0_elicit_4.wav	kuti ukumona utuntu utwingi utulesalakata pa mumana fyasunguka sana	6.4	M	1
1	01-180101-143137_bem_d31_elicit_7.wav	bushe walishiba eko twafuma ine naba emmanuel pakuti wise ulelanda ifyo	4.56	M	1
1	01-201012-192322_bem_fb0_elicit_7.wav	abana banakashi basambilila ifingi kuli banyinabo abaume nabo kuli bashibo	9.23	M	1
1	01-200918-130145_bem_d31_elicit_1.wav	yohane atemenwe ukulanshanya na bantu mu kwipushanya	4.06	M	1
1	01-200921-163326_bem_d31_elicit_1.wav	ifi efyo ukwishiba kwa baibele mu nkuta shesu kuli	4.83	M	1
1	01-201001-234513_bem_fb0_elicit_45.wav	kabili alishininkishe ukuti ulya kalata tafumine kuli banyina mwaice yafumine kuli kapenta ku lusaka	6.6	M	1
1	01-200918-120021_bem_d31_elicit_38.wav	ilyo bafikile pa mpela ya musebo baalukile ku kulyo no kutwalilila ukwenda mpaka bafikile pa ng'anda iyakwete ibala pantanshi ilyaliminwe busaka busaka	12.39	M	1
1	01-200922-012211_bem_d31_elicit_15.wav	tutungililwa naba mukabungwe ka ipusukilo children's trust elyo nabena kristu bamo aba muno chingola	9.69	M	1
1	01-201001-195552_bem_fb0_elicit_21.wav	ala kuti nga wamonako nelyo ushaishiba kabili taufwaya kucinda ubo bushiku kuti wapanga ukuti na iwe ukeshibe	10.3	M	1
1	01-201012-183344_bem_fb0_elicit_21.wav	bena nga batemwa kuti balundapo no kubalesha ukununanuna	4.27	M	1
1	01-200917-234543_bem_d31_elicit_1.wav	mu kubelenga twamona ifintu fibili ifyatangilile ububomfi bwakwe pamo ngo lubatisho no kweshiwa	6.6	M	1
1	01-180101-062208_bem_d31_elicit_8.wav	pali apasuma kabili apacindama icakuti ulupwa lwakwa ro tekuti bakwanishe	7.26	M	1
1	01-200918-120021_bem_d31_elicit_48.wav	alesubila ukuti ukulanshanya na bawishi tekuti kukokole	4.4	M	1
1	01-200922-093621_bem_d31_elicit_14.wav	tamwene ukuti nelyo taliko bashimapepo ba ku mwalo kuti babomba imilimo yonse bwino bwino	6.76	M	1
1	01-200918-132008_bem_d31_elicit_20.wav	bushe ciwa abomfeshe mano nshi pakuti atunke paulo uwakosa filya	4.17	M	1
1	01-201001-203149_bem_fb0_elicit_45.wav	pali citatu nkesa pa nshita iyo ine mwalumbula	4.15	M	1
1	01-200929-221342_bem_fb0_elicit_7.wav	bakapenta baieyangala nabo mu lusaka e bamufundile bati	8.01	M	1
1	01-201001-195552_bem_fb0_elicit_26.wav	ala mukwai umunensu na nasonda alisukumwike	4.56	M	1
1	01-200921-192247_bem_d31_elicit_41.wav	bushe mucita shani nga muli no mulimo uucilile amaka yenu kabili nimwe fye mwishibe ifyakuubomba bwino	9.39	M	1
1	01-201005-224141_bem_fb0_elicit_47.wav	fyalolela kasuba konse teti fimone isabi likatwemo nakalya fye	6.08	M	1
1	01-201001-172058_bem_fb0_elicit_40.wav	bushe mailo nga bakupela ulusa lwa kuleka incite kuti calinga nshita nshi pa kuyafikako	8.3	M	1
1	01-201001-174927_bem_fb0_elicit_20.wav	ilyo afika afwaya ukuluba janet ku mifwalile cikashana afwele cikashana afwele icakuti nafilwa no kulondolola	9.12	M	1
1	01-200922-090011_bem_d31_elicit_48.wav	umulandu uukulu twalelolekeshapo uno mwaka kulenga abasambi	6.94	M	1
1	01-180101-213930_bem_d31_elicit_22.wav	nga cakutila niwe waba nomulimo wakusunga abalupwa lyena mufwile ukusuminishanya na bena mwenu	7.65	M	1
1	01-201012-193916_bem_fb0_elicit_37.wav	bena aba kuti lyonse ilyo babatuma banakilila te mulandu nelyo pashili cilambu	6.6	M	1
1	01-180101-031848_bem_d31_elicit_48.wav	ukufuma pa bushiku bwakwa jim ford balakwata abena kristu abesa ku misonkano imisonkano ya ntungulushi ba scripture union ba nurse ba cf	11.48	M	1
1	01-201001-172058_bem_fb0_elicit_31.wav	janet  e mulumendo afwaya ukungupa	3.92	M	1
1	01-200929-223449_bem_fb0_elicit_24.wav	janet apo atemwa nganshi ico bamupokako	3.7	M	1
1	01-200918-110012_bem_d31_elicit_43.wav	pa fintu ificitika mu mushi nangu mwibala	3.22	M	1
1	01-201002-013220_bem_fb0_elicit_14.wav	ulucelo pa one september joni nakaka atala aya ku kushalikapo banalume	7.62	M	1
1	01-200922-104230_bem_d31_elicit_3.wav	ba levy chibu kasoma balolekeshe panshila yakubombelamo ubusambi elyo bamunyina ba stephen kaunda balolekeshe pamulandu wakusakamana umulimo twapelwa uwa kulenga abasambi	15.36	M	1
1	01-180102-181703_bem_d31_elicit_50.wav	kuti twatemwa nakabili ukulanda ku bekala caalo mu ncende iya lekana lekana	5.76	M	1
1	01-201012-192322_bem_fb0_elicit_17.wav	nga ni pa kutema kuti abaice baya balekola impembya nga ni pa kupindila kuti baya balepanda ifishololo ifyakuyatobelako ubwali ku mushi	15.59	M	1
1	01-200929-215409_bem_fb0_elicit_25.wav	batata bansenga baku petauke lelo bamayo bena basezuru ba ku salisbury ku rhodesia	10.71	M	1
1	01-200922-000917_bem_d31_elicit_10.wav	cila ishiwi neshina balililondolola	4.31	M	1
1	01-200917-185936_bem_d31_elicit_24.wav	kuti catuwamina ukubika mano kuli uku kupekanya ukwa ku mulu	5.15	M	1
1	01-201005-222019_bem_fb0_elicit_55.wav	naendi tulamona na muno nshiku inuni yabikapo fye ukwitilila inshimu	5.4	M	1
1	01-201002-005539_bem_fb0_elicit_53.wav	namutekenya atemwa nganshi pa kumona janet	3.61	M	1
1	01-200929-221342_bem_fb0_elicit_22.wav	joni atampa ukulolesha  mpanga yonse ukuti amone janet nga naisa kale afwaya afwaya nakalya janet tewakumoneka	10.44	M	1
1	01-201004-201313_bem_fb0_elicit_56.wav	umuntu alecita ifyo fine inshiku shonse isho mfubu alebomba pa citemene pamwakwe casuka icitemene caba ngo mulasa wa mfumu	9.21	M	1
1	01-201006-090721_bem_fb0_elicit_8.wav	bafumya ne yoma bashikanga kuti nga kapanga akuntapo yati na mbi mbi mbi	10.57	M	1
1	01-201001-193222_bem_fb0_elicit_3.wav	alasamba fye alalolela cibusa wakwe japhet daka uo bapangane nankwe ukumusenda muli motoka wankwe	9.71	M	1
1	01-180101-140752_bem_d31_elicit_11.wav	iwe walaluba munomwine mu town nga tanjishiba	3.24	M	1
1	01-180101-141937_bem_d31_elicit_10.wav	uleti nokuti inkwetekofye hundred kwacha	2.5	M	1
1	01-180102-143243_bem_d31_elicit_15.wav	filling station iyi yakulwa naba pf gavamenti	4.9	M	1
13	13-201009-112851_bem_40e_elicit_4.wav	aishile tulesha no kulya katapa no bowa ati katapa mapipo ya bana ubowa nabo matwi ya bafwa	13.18	M	1
1	01-201004-201313_bem_fb0_elicit_20.wav	naposa ne milando ikalamba kunse pakuti tailecingilila inshila pa kusenda ifibuula	7.74	M	1
1	01-180101-020958_bem_d31_elicit_14.wav	ngumfwile amenshi yasabuka kulya	3.72	M	1
1	01-201001-201528_bem_fb0_elicit_14.wav	ala laifi muno lusaka nomba elyo acilile ukununkila	3.88	M	1
1	01-201001-231632_bem_fb0_elicit_24.wav	paul nga iwe ico wikalile cinshi nga babiyo mwishile nabo nabaya	6.53	M	1
1	01-201002-003945_bem_fb0_elicit_9.wav	pantu abengi muno kalale abawama umusango uyu	3.79	M	1
1	01-200930-081904_bem_fb0_elicit_49.wav	janet bamo tabasambilila atemwa ukuipakamisha bambi nabo benda na bakapenta kasuba konse	9.01	M	1
1	01-200918-113920_bem_d31_elicit_27.wav	cilangililo nshi wingatemwa ukukonka	2.06	M	1
1	01-200918-081050_bem_d31_elicit_3.wav	pamulandu wine pa sixteen july nineteen ninety abakalamba ba filonganino naba minshoni mu filonganino fya christian brethren mu zambia balikumene ku kalulushi chibuluma pakulolekesha pa lupapulo lwa cmml	19.56	M	1
1	01-201001-193222_bem_fb0_elicit_12.wav	nshila yonse daka aleumfwa ngo uli mu ciloto ku mulandu wa kulowa kwa kacena kalefuma kuli janet	7.55	M	1
1	01-201012-180720_bem_fb0_elicit_11.wav	limbi nga ashuka kuti aya mu kulya lelo nga emine nalo noko aya lumo lwine	9.14	M	1
1	01-200914-194432_bem_d31_elicit_24.wav	nala bwela icungulo insage impiya shandi	3.86	M	1
1	01-180101-213930_bem_d31_elicit_37.wav	moneni mu mpendwa twenty verse twelve umusango lesa alondolwelamo kuli wena	6.38	M	1
1	01-180101-223427_bem_d31_elicit_42.wav	mu myeshifye iyakupenda balikwete ibumba lya bantu ilyalinga	6.01	M	1
1	01-201006-105203_bem_fb0_elicit_46.wav	ici calengele ukuti inkalamo ne mbwili ne fiswango fyonse ifya mu mpanga fiipatishe no kucila	7.42	M	1
1	01-200929-223449_bem_fb0_elicit_8.wav	janet ico atesha insele shafulisha aleka na ku lupi ati fye cilumendo wine ulya pa kanwa na paa	10.8	M	1
1	01-200921-163326_bem_d31_elicit_28.wav	ilingi line balesange nshila shakuleukilamo kucite fyo baibolo yalesambilisha	5.38	M	1
1	01-180101-045438_bem_d31_elicit_43.wav	bushe imishitishishe ya iyi magazine ku ncende mwikalila yaba shani	4.74	M	1
1	01-201005-224141_bem_fb0_elicit_42.wav	icalipo cimbi icikalamba casosa aciti oh naishiba umulandu isabi lishikatilwe lelo mu masumbu yesu	8.6	M	1
1	01-201012-190124_bem_fb0_elicit_13.wav	pantu utuni twatemwa ukulepya umulilo pa kuti tulekolako utupaso utulebutuka umulilo	7.4	M	1
1	01-180101-134124_bem_d31_elicit_32.wav	bushe namukwata inambala yabo	2.11	M	1
1	01-201005-232741_bem_fb0_elicit_17.wav	apo pene cibinda na wishi baishiba abati te cimbi malibu ayo yaisa yaleipaya abantu	8.19	M	1
1	01-200921-163326_bem_d31_elicit_46.wav	ifintu fya musango yu fyalembelwe kale sana kukutusambilisha	5.08	M	1
1	01-200922-090011_bem_d31_elicit_40.wav	mukwai nga mwalipuswa kuli uku kulongana ninshi lekeni mwebe ifyo mwalipuswa ku mapalo yakwa lesa	7.71	M	1
1	01-180101-044203_bem_d31_elicit_12.wav	iciputulwa ca cilya cungulo bushiku caiswilemo inyimbo shakulumbanya elyo nokushinshimuana ukupeela ulya musonkano kuli lesa	12.59	M	1
1	01-180101-020137_bem_d31_elicit_18.wav	ku north america kwaliba ifishishi fimo ifyakwata ukusakamana sana imilimo ibili ukututila ifyakulya na ukulungisha ifinsa	13.0	M	1
1	01-200922-010446_bem_d31_elicit_19.wav	eico ukwabula amashiwi yakwa lesa ubumi bwenu bwapelela fye pakati bwabo ubumi ubwapelela pacakulya mulya	11.05	M	1
13	13-201009-112851_bem_40e_elicit_15.wav	mutumuna na kaela e fipooma ifinono ifyabela pa mulu wa chishimba mu luombe	8.87	M	1
1	01-180102-181703_bem_d31_elicit_12.wav	ifingi balatushimikila ili lyashi ifyo baendele	3.13	M	1
1	01-201011-221153_bem_fb0_elicit_10.wav	abali no kutendeka bantu babalilapo ukutola inanda nelyo pe bumba apali uwacipingula ukucita icangalo	12.3	M	1
1	01-201012-190124_bem_fb0_elicit_12.wav	limbi balakosha umulilo babikapo na mabuula ayengi e pakuti icushi cifule utuni e pa kwisa bwangu	10.46	M	1
1	01-180101-031630_bem_d31_elicit_44.wav	fwailisheni mu malembo apalelanda pali ubo bwafya bwa bwikalo mwasangwamo	5.81	M	1
1	01-180101-140752_bem_d31_elicit_25.wav	kuti mwalanda no mwanakashi imwe	2.06	M	1
1	01-201005-222019_bem_fb0_elicit_53.wav	umuntunse eya mwandi tata wakulampususha ku cipowe e calenga ukufuma ubushiku bwa lelo waba uli cibusa wandi	10.35	M	1
1	01-201012-192322_bem_fb0_elicit_12.wav	inshita yonse abafyashi bali no kuya mu mpanga balakunguba abana bonse bashako bamo abakucita utulimo twa mu mushi	10.89	M	1
1	01-200918-132008_bem_d31_elicit_10.wav	dabidi ali mwaice umusuma alibikile amano ku masambililo kabili alefwaisha ukubomba mu cipatala panuma ya masambililo yakwe	8.46	M	1
1	01-180101-042805_bem_d31_elicit_24.wav	ifyabupe fya mupashi	2.54	M	1
1	01-201006-002700_bem_fb0_elicit_39.wav	ashipwa fye ukutasha imijomba abuulapo no bulendo alaya na ku mushi kumwakwe	6.62	M	1
13	13-201009-113828_bem_40e_elicit_12.wav	kanshi ni ba chilufya baleya mu kukosho mulilo pa nsaka	5.15	M	1
1	01-201001-174927_bem_fb0_elicit_32.wav	janet te pa kutemwa neco mu bumi bwakwe tapali icawama ngo lupiya kuti pa kupoka ne minwe ili iyacenjela	9.85	M	1
1	01-200921-163326_bem_d31_elicit_6.wav	balipelwe nsambu shakuba inte shakwa kristu kabili abakwimininako kristu	6.33	M	1
1	01-200918-101707_bem_d31_elicit_43.wav	ica cibili imilimo ya misepela ilingile ya bamo kubomfya kwa mubili amatontonkanyo pamo no mupashi	7.19	M	1
1	01-200918-113920_bem_d31_elicit_35.wav	ama magazini ya bena kristu ilingiline yatendekwa no muntu uukwete icimonwa ukufuma kuli lesa ica kukoselesha elyo no kukula abena kristu banankwe ukupitila muli iyi nshila	16.18	M	1
1	01-201006-105203_bem_fb0_elicit_43.wav	eifi fine icita na nomba pa kutasha	3.81	M	1
1	01-200922-110537_bem_d31_elicit_11.wav	magazine ya bena kristu ukuli konse pano isonde	3.56	M	1
