speaker_id	audio	sentence	duration	gender	gender_domain
1	01-201001-204524_bem_fb0_elicit_13.wav	amatiimu yonse yalemoneka kwati nayalingana amaka	4.04	M	1
1	01-201002-005539_bem_fb0_elicit_44.wav	janet ata ine kuti naya ku petauke ku mpanga ndi no kuya ku harare	6.72	M	1
1	01-180101-023548_bem_d31_elicit_47.wav	nokulanda nankwe pamo nga shifwe uwa mu mulu umusango wa mipepele yesu ukashintilila pa nshita iyo tuleposa mukuba fweka na lesa	11.93	M	1
1	01-180101-020137_bem_d31_elicit_29.wav	ukwenda mu ntampulo sha bashifwe	2.9	M	1
1	01-180101-031630_bem_d31_elicit_27.wav	pamulandu wakuti umuntu alengelwe mu cata cakwa lesa nao nakonkomeshiwa	6.58	M	1
1	01-180101-143137_bem_d31_elicit_49.wav	iwe ikalafye tapali efyo unganjeba	2.65	M	1
1	01-180101-060018_bem_d31_elicit_50.wav	imisepela iyingi mu ncende ishalekanalekana nayikwatila utubungwe twaiko	5.69	M	1
1	01-201001-195552_bem_fb0_elicit_18.wav	pa kutampa kwa fyangalo batalile balomba shibwinga na nabwinga ukuti besule ukwangala	6.99	M	1
1	01-201012-182347_bem_fb0_elicit_9.wav	aba uko bekalile bapekesa utulindi mu mushili umulongo emo baimika impeta na banabo nabo ifyo fine	11.62	M	1
1	01-200922-102640_bem_d31_elicit_20.wav	ibumba ilyo shikulu asalile ilya basambi lyali ilyaibela nganshi	5.42	M	1
1	01-180101-023548_bem_d31_elicit_29.wav	nouwen mukutwalilila atile 'ilipusho ilifwile ukutungulula bonse '	6.06	M	1
1	01-200918-101707_bem_d31_elicit_48.wav	amalembo ya mushilo yalikwata fyonse ifyo imisepela ikabila pakuti bekale imyeo yakutemwa lesa	7.99	M	1
1	01-180101-062208_bem_d31_elicit_3.wav	ici calepilibula ukutila ro ali nokuya ku sukulu panshita iyi tali no kwikala ku ncende iyeni	8.46	M	1
1	01-180101-031848_bem_d31_elicit_31.wav	imo kuli abo balefwaisha ukwishiba palwa milembele yafitabo	6.44	M	1
1	01-200918-081050_bem_d31_elicit_6.wav	no lupapulo lwalembelwe panuma yakulanshanya lusumbula amalembo yamushilo ne fikomo fifwile ukukonkwa mu lukuta lwakwa kristu mu cipingo cipya	13.59	M	1
15	15-201009-114723_bem_40e_elicit_19.wav	limbi mulamonana na banenu bamo abafwa mu kulota kwenu muli pamo na bomi	8.3	M	1
1	01-201012-184652_bem_fb0_elicit_9.wav	kabili imfula nga yalaloka kuti yafutula amaliba	6.69	M	1
1	01-201006-093742_bem_fb0_elicit_12.wav	cilemoneka ukuti nelyo ifwe tushipwile ku mulandu wa kutwipaya umwine	7.15	M	1
1	01-201005-230705_bem_fb0_elicit_0.wav	apo pene catendeka no kupunda ku fibive aciti mwe mwe mwe	6.24	M	1
1	01-201002-002057_bem_fb0_elicit_21.wav	joni nga fitampile lilali	2.43	M	1
1	01-200918-112337_bem_d31_elicit_0.wav	impanga shandi shilomfwa ishiwi lyandi	2.18	M	1
1	01-201006-093742_bem_fb0_elicit_16.wav	pa bushiku bwa lelo ine namupela icebo cakuti tulofye umuntu muno calo uleke tukaishalile	7.58	M	1
1	01-200914-214639_bem_d31_elicit_0.wav	abantu bonse babutukila ku mfumu	2.47	M	1
1	01-201011-231356_bem_fb0_elicit_11.wav	nga bafika bali no kumona pa lubansa apasebeka apasensebuka atemwa pa lukungu lwa nanda ya bafyashi babo epo bakolongana	13.09	M	1
1	01-180101-042805_bem_d31_elicit_23.wav	umutima wa nkumbu kabili uubelela uluse	3.02	M	1
1	01-200922-093621_bem_d31_elicit_20.wav	lelo paulo aile ku mwalo mu kuitemenwa mu kuimona ukucenjela na bumushilo ukucila bonse	8.89	M	1
1	01-201005-232741_bem_fb0_elicit_36.wav	pali kantunse kapwa	2.31	M	1
1	01-201001-174927_bem_fb0_elicit_26.wav	banina janet aikata na joni mu musana	3.68	M	1
1	01-200930-150533_bem_fb0_elicit_3.wav	ulya mukashana ni cibusa wandi kabili mfwaya ukuti nkamuupe kanshi tacilingile ukuti na iwe ulemupempula watesha ngoli mwana wa muntu	12.12	M	1
1	01-201005-224141_bem_fb0_elicit_0.wav	amatukuto ya fyula	2.16	M	1
1	01-200917-132419_bem_d31_elicit_8.wav	lesa atumine kasesema samwele ku ng'anda yakwa yese umwina betelehemu	6.01	M	1
1	01-180101-221817_bem_d31_elicit_36.wav	elyo na kucilisha abekalamushi abo nga kabungwe tubomba nabo	6.92	M	1
1	01-200922-110537_bem_d31_elicit_30.wav	kalemba mukalamba editor elyo nakabungwe ka bampandamano	6.81	M	1
1	01-200921-163326_bem_d31_elicit_48.wav	paulo acinkwile abakalamba balukuta ukuti panshita yamyaka itatu ilintu ali nabo mu efese alepyungila shikulu	8.83	M	1
1	01-201006-105203_bem_fb0_elicit_50.wav	mulamona na lino line imbwa no mumbulu tafyapatana kuti nga fyakumana filenunshanya fye	8.64	M	1
1	01-201012-184652_bem_fb0_elicit_30.wav	te kwa kolola na musana kuti uyu nafitwalinkana ukupyata imimposemponse no kukaka kuli tunamupilikisho no kukakilako utumuti utunongo	17.9	M	1
1	01-200914-214639_bem_d31_elicit_47.wav	iwe ninkweba ukuti akalale kakulu uku tuleya kuti naishiba shani apakwikilila iwe nga taupeshibe ishina	7.85	M	1
1	01-200922-003122_bem_d31_elicit_30.wav	muke alondololwele ifyacitike elyo alombele ukuti shimapepo amwafwe mukutwala umukashi wakwe ku cipatala	9.14	M	1
1	01-201004-201313_bem_fb0_elicit_50.wav	ifyo fine ku nshita ya cungulo aleta umusumba umbi	4.74	M	1
1	01-200918-120021_bem_d31_elicit_35.wav	natusambilile ca pamo ifyo twingacita bwino	2.65	M	1
1	01-180101-120903_bem_d31_elicit_21.wav	kabiyeni mukabete mukwai	2.16	M	1
1	01-200917-223740_bem_d31_elicit_6.wav	ulukuta libumba lya mushilo	2.61	M	1
1	01-200918-081050_bem_d31_elicit_36.wav	abantu bamo balantunganya suspect ukuti ndabomfya amalele mu makwebo yandi	6.6	M	1
1	01-200922-003122_bem_d31_elicit_40.wav	imikalile yakwe muke yatendeke ukulondoloka	4.4	M	1
1	01-201012-180720_bem_fb0_elicit_23.wav	elyo kanshi nga kwaba bamo abakushinshintisha kuti baikala balata fye nakabili no kuseka balaseka	8.14	M	1
1	01-180102-143243_bem_d31_elicit_57.wav	uko umulumendo aishile ipaya mulamu wakwe munshila iyabipa nganshi	5.08	M	1
1	01-201002-011519_bem_fb0_elicit_21.wav	joni icamusakamika no kucila ni nkoloko yakwe iyo atemwa ngo mwana aeba banalume ati yama ine pa thirty ndi no kuya nafwaya janet	10.44	M	1
1	01-201004-201313_bem_fb0_elicit_44.wav	kuti basuna fye intoshi shitatu balecibika fye no muto bapwila	6.24	M	1
1	01-201001-195552_bem_fb0_elicit_34.wav	banyina kwa janet bena bali abasekamana pa kumona janet wena nangu bonse bali abasansamuka ena ali uwakutumana kabili bulandabulanda	13.54	M	1
1	01-201001-204524_bem_fb0_elicit_37.wav	ala nshilati nkulabe na nomba ncili ndekwibukisha	4.2	M	1
1	01-200929-223449_bem_fb0_elicit_15.wav	leka kanshi nkufunishe nga tawanjishiba	3.4	M	1
1	01-180101-140752_bem_d31_elicit_7.wav	tiyeni imitwale ku sitesheni ba yama benu limbi nabafika	4.54	M	1
1	01-200929-223449_bem_fb0_elicit_35.wav	joni kwena nshilati nande nankwe ilyashi lya musango yo pantu tatulaishibana sana	8.49	M	1
1	01-180101-023548_bem_d31_elicit_34.wav	muli marko fourteen thirty four tubelenga ubwafya bumo ubo yesu ashingwene nabo umusalaba	7.37	M	1
1	01-201002-002057_bem_fb0_elicit_20.wav	janet ndeumfwa impepo no mutwe ubwafita na fititi	4.88	M	1
13	13-201009-113828_bem_40e_elicit_27.wav	na ine nakonkanyapo nati umuntu uwaba ngoyu wine naisa na mwa mama	11.14	M	1
1	01-201012-182347_bem_fb0_elicit_21.wav	nga ali umo ni kapala	2.34	M	1
1	01-180101-020958_bem_d31_elicit_25.wav	nga tutila tatwaba na bubifi ninshi tulaibepa ne cishinka tamwaba muli ifwe	5.24	M	1
1	01-201001-203149_bem_fb0_elicit_6.wav	joni alailumba no kuilumba ati wankutika ne mwana wa mubemba calesa nook nafuma bonse tuli nkakashi	10.03	M	1
1	01-200914-200932_bem_d31_elicit_8.wav	nalakupela iya tiketi nga naingila elo naikala mukati mwa basi	4.56	M	1
1	01-180102-143243_bem_d31_elicit_56.wav	ku mongu mukwai pali uyu mulungu kwaponeke umupamba	4.86	M	1
1	01-200921-163326_bem_d31_elicit_32.wav	bushe fintu fyamusango nshi tusambilisha	3.88	M	1
1	01-201005-222019_bem_fb0_elicit_33.wav	amani yonse yatobaika inshimu shapwila fye yonse luni pa kubwela uko aciba abutukile asanga fye ifipaapa fyekafyeka e filemulolesha	13.54	M	1
1	01-200917-231428_bem_d31_elicit_9.wav	pakutendeka fye marko alefyaya ukuti bakabelenga bamone cishinka cakuti ifyo balebenga lyashi lisuma ku balelibelenga no kulitetekela	11.18	M	1
1	01-200922-110537_bem_d31_elicit_50.wav	ukubomba umulimo wakufwailisha pa milandu imoimo iikumine uyu mulimo	6.15	M	1
1	01-200922-110537_bem_d31_elicit_56.wav	lekana muno africa shikalongana muno zambia mu mweshi wa august	7.15	M	1
1	01-201011-223928_bem_fb0_elicit_27.wav	nga bayapona mu tulo tekwakwishiba nelyo bucele nga tulumendo natulaba na ku kukosha umulilo pa nsaka	8.76	M	1
1	01-200921-163326_bem_d31_elicit_40.wav	na yesu alicenjeshepo alisokele abantu pamulandu wa ubu bwafya mwaleke funde lyakwa lesa no kubake fishilano fya bantu	9.78	M	1
1	01-201011-234841_bem_fb0_elicit_7.wav	nga tapali ibeta ukuta teti kulondoloke	4.86	M	1
1	01-201001-223110_bem_fb0_elicit_1.wav	joni ati leta kanshi mone ifilemba bamayo na ine njishibe ukuboko kwabo	8.03	M	1
1	01-200918-112337_bem_d31_elicit_11.wav	musango nshi ubuntungwa bwacine bumoneka	4.4	M	1
13	13-201009-113828_bem_40e_elicit_23.wav	abanensu umushaingile ulya muntu bayasuka abati tubukile bwino	11.84	M	1
1	01-201001-234513_bem_fb0_elicit_0.wav	ilyo banalume kwa joni balelanda janet atalele fye tondolo alelolesha na panshi	6.35	M	1
1	01-180101-062208_bem_d31_elicit_47.wav	mfwile nafwa icakubafwilisha mfwile nasanga indyabuluba bwangu bwangu	6.97	M	1
1	01-200918-081050_bem_d31_elicit_22.wav	bushe imwe mwatampile ukukonka imfumu yesu yesu kristu lilali	3.65	M	1
1	01-201001-195552_bem_fb0_elicit_10.wav	kuti mu mulungu wa citatu apo joni na janet baishile ku lusaka	5.15	M	1
1	01-201001-223110_bem_fb0_elicit_13.wav	ukutontonkanya kwaisa mu mutima ukwa kukwata abana ukukanaya ku biaolo apo alefwaila ukwikala pa nganda pen go musha ukucapa no kucisa ifyakufwala fya mulume	14.88	M	1
1	01-200917-202141_bem_d31_elicit_3.wav	ili lisambililo kuti lesa afwaya babomfi bakwe ukutendeka ukumubombela palya pene basangwa	7.19	M	1
1	01-200918-113920_bem_d31_elicit_33.wav	mulandunshi yohane alembele iyi mbila nsuma	2.63	M	1
1	01-200922-104230_bem_d31_elicit_42.wav	ukutasha kwesu kuti kwaba ukwafye nga nalabako abatwafwilisha ku ndalama	5.67	M	1
1	01-200922-110537_bem_d31_elicit_34.wav	intungulushi ishiletungilila umulimo mufilonganino fyabo	5.26	M	1
10	10-200914-180622_bem_346_elicit_3.wav	finshi tulelota ukuti fikaba ifyakwa ifya kuntanshi	7.03	M	1
1	01-200918-113920_bem_d31_elicit_42.wav	kabili balafwaya na bambi abena kristu abengabatuminako ifikope elyo nefilengo mukulenga ukuti magazini amoneke bwino	7.53	M	1
1	01-200914-202459_bem_d31_elicit_20.wav	shifumine kwisa inkongole	2.2	M	1
1	01-200929-215409_bem_fb0_elicit_28.wav	joni mukwai njikala ku mine compound	3.2	M	1
1	01-201005-230705_bem_fb0_elicit_3.wav	cilya icibiye caisa nomba fyonse fibili fyayamba ukwita ifinabo fimbi fyonse fyalongana na palya pene	9.76	M	1
1	01-201001-234513_bem_fb0_elicit_24.wav	joni e pa kutampa ukulya ubwali alyapo fye isha kupenda aeba janet ukuti amupeele umunkoyo	7.6	M	1
1	01-201001-174927_bem_fb0_elicit_25.wav	pa kwikala pa citukutuku janet abala apempentesha bwinobwino amalaya yakwe pakuti umwela taumufimbwile	8.24	M	1
1	01-200918-113920_bem_d31_elicit_3.wav	mulandunshi yesu akokwelele ukwisa nangula cali cakuti alitemenwe malita	7.58	M	1
1	01-180101-023548_bem_d31_elicit_17.wav	yesu aipakishe nganshi ukwishiba ifintu ifyashika pafyo wishi wa mumulu aba ilyo aleposa inshita na wena ekafye	11.73	M	1
1	01-200918-101707_bem_d31_elicit_36.wav	nga cakuti abantu balefwayo kufikilisha mapange yabo mu bwikalo cikankala ukuteyanya bwino	5.81	M	1
1	01-201006-112930_bem_fb0_elicit_40.wav	ale isa kuno iwe asonta na pali nduba e ushapundileko	6.92	M	1
15	15-201009-114723_bem_40e_elicit_40.wav	eco ifwe tulila mu ciloto nico tufwaya ukusansamusha imibili ii tulisha	8.69	M	1
1	01-201004-205737_bem_fb0_elicit_18.wav	eya mwandi lelo tulekumana ne filyo	3.4	M	1
1	01-200918-112337_bem_d31_elicit_7.wav	kuti waishiba shani nga cakuti ifundisho waumfwa lifumine kuli lesa	4.72	M	1
1	01-180102-143243_bem_d31_elicit_21.wav	nabo bene tabalekwata ama futa	2.84	M	1
1	01-201005-212422_bem_fb0_elicit_39.wav	nomba uwalipo umukalamba umo gsosa ati kwena ilya nama ikali tatwishibe nefyo ifwantilwe	8.6	M	1
1	01-200918-082418_bem_d31_elicit_45.wav	mucine imisepela ukufuma mu filongannino fyesu eko bali nabena  tapali nangu umo ulefwaya ukupanya ilishuko likalamba ilikukwatilapo amasambililo nayambi elyo ne citupa	16.9	M	1
1	01-201006-093742_bem_fb0_elicit_20.wav	ico imbwa yaikalile shilili yaletontonkanya nga cinecine kuti calinga ukulofya abantu	6.44	M	1
1	01-200922-084033_bem_d31_elicit_13.wav	imitima yabo mwaisula icipyu	2.52	M	1
1	01-200914-202459_bem_d31_elicit_32.wav	kwalifye ku papata pakuti aleke uku shauta	3.68	M	1
1	01-180101-221817_bem_d31_elicit_22.wav	icilemoneka ngo bwasuko abasambi baebelwe ukusenda nkonto shabo isho baleendelako  lelo tabasuminishiwe ukusenda shibili	12.05	M	1
1	01-180101-031848_bem_d31_elicit_2.wav	cila lucelo pa eight forty five ukufika nine fifteen kwaleba isambililo ukufuma mu cipingo	6.78	M	1
1	01-200918-113920_bem_d31_elicit_49.wav	enshila shakubombelamo umulimo yakwa lesa	3.22	M	1
1	01-201005-230705_bem_fb0_elicit_33.wav	amweba no kumweba ati mwana wandi amalibu aya nakupeela yantu yayafya sana te kwesha umuntu umbi ukwikatako kano fye iwe we mwine	11.18	M	1
1	01-180101-134124_bem_d31_elicit_36.wav	hmm imilembele bushe iyi inambala iyakulekelesha ninshi	4.29	M	1
1	01-201001-193222_bem_fb0_elicit_30.wav	banyina kwa janet te pa nsansa pa kumona joni lumbwe wa mwana wabo	7.44	M	1
1	01-201001-172058_bem_fb0_elicit_10.wav	janet ati ateshe umusowa wa citukutuku washimina mupepi aisafumina panse amona ni joni uyu aleisa	9.71	M	1
1	01-201012-190124_bem_fb0_elicit_32.wav	pantu ukulengula bacita imiku ibili ulucelo ne cungulo	4.56	M	1
1	01-200922-084033_bem_d31_elicit_26.wav	baposa inshita ishingi pa fintu ifishilebanonsha nangu fimo	5.1	M	1
1	01-180102-143243_bem_d31_elicit_5.wav	umo baikala muno mu calo ca zambia	2.99	M	1
1	01-201006-090721_bem_fb0_elicit_26.wav	ulucelo lumbi kabili abantu bafurnina mu milimo	5.35	M	1
1	01-201012-192322_bem_fb0_elicit_18.wav	abalumendo ifyakucita fyalifula bana ba mfubu bangala matenga yonse	6.69	M	1
1	01-200922-100107_bem_d31_elicit_9.wav	pa mpela ya muputule pali icipuna cimbi pamo no mwakubika ifyakufwala	7.19	M	1
1	01-201006-105203_bem_fb0_elicit_16.wav	basuka na bonse balongana	2.72	M	1
1	01-200922-010446_bem_d31_elicit_44.wav	ba kelvin samwata bacili nobulanda sana ilyo lyonse batulondolwela ici cintu cabacitinkile icabulanda	10.5	M	1
1	01-200914-214639_bem_d31_elicit_43.wav	naile mukumonafye ba bululu	2.2	M	1
1	01-200929-223449_bem_fb0_elicit_48.wav	nabo neco bali na mano ya mu tauni	2.61	M	1
1	01-201001-204524_bem_fb0_elicit_28.wav	umutima umo wamweba ati isula umone ifilimo	3.52	M	1
1	01-180102-181703_bem_d31_elicit_29.wav	elyo nefyo balekabila ukumona pa mulimo wa bumi balabomba kuli iyi incende	5.51	M	1
1	01-201006-090721_bem_fb0_elicit_45.wav	pa lubelebele pa luncecesa	3.04	M	1
1	01-201001-231632_bem_fb0_elicit_38.wav	iwe auba na mano ya kumutiina nga teti ulecita ifyo ashifwaya	6.53	M	1
1	01-201013-132016_bem_fb0_elicit_5.wav	nga ulefwaya ukumonona atemwa ukubikako amenshi niwe mwine cifu ca ngulube citemwa mwine	9.55	M	1
1	01-200918-082418_bem_d31_elicit_13.wav	ukulanda pa myeo yesu ifyo twaba pali ndakai nefyo tulecita mu bwina kristu bwesu	6.49	M	1
1	01-180101-023953_bem_d31_elicit_0.wav	twaishibo kuti bonse abasosa icine ku bantu balapakaswa	5.51	M	1
1	01-200917-185936_bem_d31_elicit_1.wav	kafikenipo bane mwilaba ukweba yohane ukwisa ku ng'anda ku mwandi e kwasuka kwakwa sembe shimapepo	10.39	M	1
1	01-201006-112930_bem_fb0_elicit_0.wav	amakanga nayo yasosa yaposa na filya	3.4	M	1
1	01-200918-082418_bem_d31_elicit_31.wav	ukusambilila ne mipepele ipya	2.25	M	1
1	01-180101-062208_bem_d31_elicit_22.wav	fyakucingilisha nshi ifyo ro akumenye mukufikilisha amapange yakwa lesa pa mweo wakwe	7.12	M	1
1	01-180101-223427_bem_d31_elicit_26.wav	apo apali minshoni yakwe iitwa bibles for the world apa epa headquarters ya iko	7.94	M	1
1	01-180101-044203_bem_d31_elicit_3.wav	elyo na bane ukufuma mu filonganino mutanda ifyaba mu ncende ya mpulungu  mbala elyo na musenga	8.69	M	1
1	01-200922-104230_bem_d31_elicit_28.wav	kanshi abana bakwa lesa batontonkenye ukumona inshila bengafwilamo	5.35	M	1
1	01-201002-000224_bem_fb0_elicit_34.wav	janet apo na maka mu mubili yapwa ku mwenso pantu ashininkisha ukuti nomba ilya nkaama yayaishibikwa	10.91	M	1
1	01-200922-084033_bem_d31_elicit_14.wav	intungulushi shilacenwa pakula bepeshiwa na banono	4.79	M	1
1	01-200922-003122_bem_d31_elicit_18.wav	imikalile yakwe panganda yali bwino ico alikwete ndalama	4.72	M	1
1	01-180101-120903_bem_d31_elicit_22.wav	mayo senge wandi muli kwisaa	2.2	M	1
1	01-200917-234543_bem_d31_elicit_7.wav	aile ku yordan kuli yohane	2.9	M	1
1	01-200918-082418_bem_d31_elicit_9.wav	muli ili lyashi tweba abantu pafyo yesu atufumya mu lubembu ekutila ukufuma mu bubi mubufumu bwamfimfi ubwa kwa satana	11.37	M	1
1	01-201001-225221_bem_fb0_elicit_27.wav	mayo na cilya lyapenesha kuti lyaisanjipaya fye	3.74	M	1
1	01-200918-072441_bem_d31_elicit_49.wav	ing'anda yakwa lesa ya mushilo	2.43	M	1
1	01-201005-224141_bem_fb0_elicit_2.wav	abulile ifyula nafyo afisontelela ku lulamba lwa bemba ukuti eko fileikala	7.15	M	1
1	01-180101-213930_bem_d31_elicit_33.wav	intanshi mu kufuma seventeen panumafye akulekelwako ukufuma mu egupt ali no kuma icilibwe pakutila engapeela amenshi kubantu abaleumana	13.5	M	1
1	01-200918-081050_bem_d31_elicit_16.wav	ilipusho lyakubalilapo nili ilyo umuntu umupya aiminina pakupwa kwa kulongana nokutila untuwatetekela elyo alefwaya ukuba membala wa ici cilonganino  lutampulo nshi tulingile ukusenda	14.93	M	1
1	01-201006-093742_bem_fb0_elicit_40.wav	eco kanshi nati kanje mbasokeko bekale abaiteyanya	5.67	M	1
1	01-200918-101707_bem_d31_elicit_39.wav	cintu icikankala ukubika mu mapepo ifintu ifikumine misepela	4.24	M	1
1	01-200917-231428_bem_d31_elicit_34.wav	yohane alipokelele uyu mulimo apelwe	2.72	M	1
1	01-180101-023953_bem_d31_elicit_27.wav	ifishima fibili ifya kubalilapo ifyo ababomfi bakwe baimbile eseke na sitna fyaba icipasho ca calo umwabafye ifikansa no mupatikisha elyo no lubuli	13.39	M	1
1	01-200930-133148_bem_fb0_elicit_9.wav	apa pa yadi mupepi na pano paba abalumendo babili abasezuru abampimpili nganshi pe nomba nalikana no kuti baleke iyoo	12.68	M	1
1	01-200917-231428_bem_d31_elicit_43.wav	lesa emwine wa mulimo wakwita bantu	3.11	M	1
1	01-201012-184652_bem_fb0_elicit_36.wav	acindama nga mala ya nkalamo	3.04	M	1
1	01-201012-190124_bem_fb0_elicit_14.wav	kanshi nga twamona icushi twasubila ukuti kuli utupaso nakaendi twasanga tunakapelele tuleima e pa kuwila pa maliba	12.66	M	1
1	01-201001-225221_bem_fb0_elicit_25.wav	janet alilwala ali ku cipatala	2.81	M	1
1	01-200929-223449_bem_fb0_elicit_13.wav	bushe uyu mukashana uletuka cinshi akucitile	3.4	M	1
1	01-200914-200932_bem_d31_elicit_27.wav	na mano yalipela yonse	2.9	M	1
1	01-200917-202141_bem_d31_elicit_45.wav	bushe cilonganino cakwa kristu catendeke lilali	2.86	M	1
1	01-201002-003945_bem_fb0_elicit_21.wav	bushe tamwaba abo mwaishiba muno ndola	3.06	M	1
1	01-201012-190124_bem_fb0_elicit_37.wav	we mwana nobe ulapalwa amate ku filolo fya pa nsaka ni teka fitalale	8.33	M	1
1	01-201013-141625_bem_fb0_elicit_17.wav	aisapisha pakati ke liba no bulyo bwaikalila pakati umumposempose wapalamisha ku iliba autinta waisafumina na pa mpela ye liba	15.25	M	1
1	01-200918-072441_bem_d31_elicit_2.wav	ifintu fyaba mu busambi efilumbulwa mu mbila nsuma yakwa marko	5.35	M	1
1	01-200930-133148_bem_fb0_elicit_19.wav	elyo kabili ayasuka ati pindayi e mukutila ingileni mu cishona	6.56	M	1
1	01-200918-082418_bem_d31_elicit_16.wav	mu bunte bwe pusukilo	2.2	M	1
1	01-201012-182347_bem_fb0_elicit_20.wav	isho ninshi shacindama sana bashipela na mashina yakutila bakapala	5.56	M	1
1	01-200918-081050_bem_d31_elicit_31.wav	bushe mwamonamo amafya ya musango shani muli uyo mulimo wa makwebo	5.51	M	1
13	13-201009-112851_bem_40e_elicit_19.wav	efyo pali na pali kalambo pene	4.45	M	1
1	01-201005-212422_bem_fb0_elicit_26.wav	leio tababikilemo ifumo bonse balikene ukuti bapele ifumo pantu ifyela fyaliafishe pa nshita ilya	7.99	M	1
1	01-180101-045438_bem_d31_elicit_29.wav	lembeni amasuko ya mepusho ayali ku mbali mu tubokoshi	6.47	M	1
1	01-200929-215409_bem_fb0_elicit_39.wav	joni nao ati efyo mukwai shalenipo ala na ine wine natotela sana pa kunsansamushako pa kashita aka twaposa babili nenu	14.07	M	1
1	01-200922-110537_bem_d31_elicit_28.wav	pakupekanya ama magazine yakuntanshi	2.61	M	1
1	01-200930-133148_bem_fb0_elicit_28.wav	abalumendo aba babili pa kumone lyashi mu nganda lyapwa bailuka abene beka ukuti tabalefwaikwa mu nganda	7.62	M	1
1	01-200917-221220_bem_d31_elicit_16.wav	alitwelele membu shesu shonse ico kristu alitufutile mu mulopa wakwe	5.6	M	1
1	01-180101-042805_bem_d31_elicit_29.wav	ukutotela lesa pa mulimo ukalamba untu atulashika	4.22	M	1
1	01-201012-182347_bem_fb0_elicit_24.wav	na mu filindi mufumine impeta balile balimba shimbi shena ishi misumbi fye	8.19	M	1
1	01-201001-174927_bem_fb0_elicit_27.wav	pa kukanafulunganya fya mukashana joni ateka umutima pa kubutuuka bele balepuma ne lyashi	10.73	M	1
1	01-180102-143243_bem_d31_elicit_25.wav	kanshi inshita yaku bomba imilimo yabuteko yalepwila mukwenda	5.08	M	1
1	01-180101-020249_bem_d31_elicit_38.wav	bushe pali ifi fyonse ni fisa mutemenwepo	3.38	M	1
1	01-200918-113920_bem_d31_elicit_18.wav	kuti waishiba shani ngacakuti umuntu umo alitemwa lesa bushe mwali mutemwa	5.99	M	1
1	01-201013-141625_bem_fb0_elicit_35.wav	pa nshita ii tabali na kushana iyo kuti pe liba lya munabo onse kano basangwepo bamone nga aipaya atemwa iyo bamupembela pakuti ateye cipyacipya	13.54	M	1
1	01-180101-044203_bem_d31_elicit_5.wav	lelo nangula cali ifyo twalimona insala ne cilaka ica cebo cakwa lesa mu myeo ya misepela ilyo yaleiteyanya iyiine na mukukolonganika kwa ndalama isho shingakwanisha	14.54	M	1
1	01-200918-120021_bem_d31_elicit_46.wav	aile alelanguluka ico bawishi balemufwaila pantu badikone bamoneke abatekanya	4.72	M	1
1	01-180101-054003_bem_d31_elicit_6.wav	bushe kuti mwatwebako ifyo mucinjishe pa mulandu wa kubelenga iyi magazine	5.08	M	1
1	01-200918-113920_bem_d31_elicit_2.wav	mwilaba ukutila nakuli baifwe bene cila lubembu mulatumbuka ifintu ifibi	4.9	M	1
1	01-180101-020249_bem_d31_elicit_26.wav	fyakuilishanya fyakubepeshiwa mafya	4.06	M	1
1	01-201013-141625_bem_fb0_elicit_7.wav	ulya uwalengula ubwendo no kwishiba ukuti ni mpuku shingilapo	4.88	M	1
1	01-201005-212422_bem_fb0_elicit_50.wav	inama nkali shonse isha mu mpanga ishalecindika cimbwi ku mulandu wa bukali bwakwe nomba shamona ukuti cimbwi aleka ukwikata inama	13.2	M	1
1	01-200922-004748_bem_d31_elicit_47.wav	nga cakuti shalyamba ukutontonkanya ukuti yesu ecibusa icacilapo shikalatila ron ecibusafye cacilapo	10.19	M	1
1	01-200922-104230_bem_d31_elicit_41.wav	namwe bonse mwebaletuma amalamya nokulanga ukuba bonse capamo tulemutotela apakalamba	7.35	M	1
1	01-200922-100107_bem_d31_elicit_13.wav	efyo yohane atendeke ukulota ukuti mwali umuntu umwaume mu muputule umo alele	6.24	M	1
1	01-200921-163326_bem_d31_elicit_7.wav	ilintu shikulu atutubwike kubafwa no kubwelela ku mulu abantu basambilile kuli wene lintu ali pano isonde ebali no kuba bakasambilisha ba bantu	13.57	M	1
1	01-180101-141937_bem_d31_elicit_35.wav	awe teti indeya ku cipatala ndifye bwino	2.59	M	1
1	01-201011-225826_bem_fb0_elicit_18.wav	bwamwikalaikala bwamubeye koshi	3.52	M	1
1	01-201005-230705_bem_fb0_elicit_10.wav	fyalolekesha cimo aciti ala mita yekayeka efyo iba pa kukula amolu yakafumako nga yakula	10.91	M	1
1	01-200930-081904_bem_fb0_elicit_38.wav	alishitilemo no tumipando utusuma nganshi	4.33	M	1
1	01-200929-223449_bem_fb0_elicit_11.wav	ekuti lilye kofi lyafikile pa kuboko kwakwa joni	5.54	M	1
1	01-200918-082418_bem_d31_elicit_10.wav	ubunte kuti bwapelwa ngefi	2.16	M	1
1	01-180101-134124_bem_d31_elicit_37.wav	nabo ba yama benu bala bika foni apatali ilelilafye tabaleyasuka	4.17	M	1
1	01-200930-133148_bem_fb0_elicit_48.wav	ati acebuke amona ni mark monyoro na peter marara nabamukonka awe anasha no kwenda pakuti bamusange	8.76	M	1
1	01-200930-154723_bem_fb0_elicit_17.wav	mr van ersen ati fyonse ifipe fya citukutuku fili fye bwino	5.67	M	1
1	01-201013-141625_bem_fb0_elicit_11.wav	te kubikila pakati ka bwendo iyo ni mupepi no bwendo atemwa mu mushita	7.19	M	1
1	01-201011-231356_bem_fb0_elicit_9.wav	ifisaye fyawamisha ni filya baswa ku mulungi na kuli sansa no mukome pantu e fyakosa tafitobeka bwangu kanshi e fyo bafwaisha	11.77	M	1
1	01-200918-090125_bem_d31_elicit_48.wav	onse kuti aikalilila mu cilonganino umo ali bena balefwayafye ukuleta amasuko yalemoneka ayabomba mu muntu uwa citetekelo icili conse konse uko engaba	12.68	M	1
1	01-201012-183344_bem_fb0_elicit_0.wav	apo ninshi baicusha fye no kulya ninshi tabalile kapala ashala fye na maka yakwe yonse	6.74	M	1
1	01-201004-201313_bem_fb0_elicit_13.wav	umuntunse yaba icimuti cakule fi eco ningabungwila mu isamba	6.51	M	1
1	01-201002-000224_bem_fb0_elicit_6.wav	ine ndeti umukashana uwawama umubili nga iwe talingile kukwata mwana	5.35	M	1
1	01-200922-104230_bem_d31_elicit_7.wav	lekeni mushimikileko ulwimbo lwaishileba pamulu	3.65	M	1
1	01-200922-003122_bem_d31_elicit_41.wav	eico asalilepo kuya na shimapepo kukulongana pabushiku bwa mulungu ubwakonkelepo	6.01	M	1
1	01-180101-221817_bem_d31_elicit_38.wav	pa myaka iyingi mwaliibimbamo mu milimo iyalekana lekana mu filonganino fimo	5.56	M	1
1	01-200929-223449_bem_fb0_elicit_30.wav	awe bafunkana mu minwe baloleshanya na mu menso apo te pali simaelo	7.31	M	1
10	10-200914-180622_bem_346_elicit_41.wav	lumbanyeni zambia nokwanga	3.77	M	1
1	01-201006-090721_bem_fb0_elicit_50.wav	bakapanga wa kantu kuluba nefyo basendele inoma no kuyanika nabayayanika na pa njino nga mailo	10.03	M	1
1	01-200922-110537_bem_d31_elicit_48.wav	umulimo ne mibele fya bakwilula	3.88	M	1
1	01-201012-193916_bem_fb0_elicit_40.wav	na limolimo kuti umukalamba amutuma ukwabika inkwa abika no bwali ne nama mukati	12.14	M	1
1	01-201012-192322_bem_fb0_elicit_39.wav	taishiba kuluka ciluka basungu	3.36	M	1
